tweet,language,labels
"""I don't think it was a deliberate act. I think it was a response to what [former NSA contractor Edward Snowden] had done that",en,0
"Un nuevo video, lanzado por la Casa Blanca, muestra al presidente Trump tomando una foto con un joven manifestante durante una manifestación en Cincinnati, Ohio,",es,2
"- Da quando abbiamo comprato il nostro primo PC, fino ad ora, siamo stati molto soddisfatti dell'esperienza.",it,2
Non posso fare a meno di pensare che ci sia qualcosa di molto speciale nel tipo di lavoro che facciamo e nel modo in cui guardiamo il mondo.,it,1
L'UESPWiki è la tua fonte per le pergamene degli anziani dal 1995 The Chunk of the Dragon (chiamato anche respiro del drago),it,2
"Las luces en la noche no son regulables, pero el lado oscuro La luz en la noche oscura está atenuada, pero la Luz",es,1
"LONDRES, Grande-Bretagne (AP) — La Commission européenne souhaite que le Royaume-Uni soit un «chef de file mondial en matière de droits de l'homme» en tant que",fr,1
"""El problema es que estamos viendo el mismo tipo de daño"", dijo, añadiendo que el ""sistema está funcionando muy bien"".",es,0
Une nouvelle ronde de financement pour le U.S. Army Corps of Engineers devrait commencer en 2018.,fr,2
"Die US-Regierung fordert den Kongress auf, die Steuervergünstigungen für den Staat und die lokalen Regierungen zu verlängern, um für ihr Geschäftsjahr 2018 zu zahlen.",de,2
Ce qui suit est une liste des jeux en ligne gratuits les plus populaires et les plus populaires sur le PC PlayStation 4.,fr,2
"Wenn sich die Welt von der Europäischen Union entfernt, wird es das zweite Mal in drei Jahren sein, dass ein Unternehmen über das Internet geschnappt wurde.",de,0
"1. ¿Por qué no incluir el número correcto de caracteres en la URL? Por ejemplo, si desea que su sitio se vea como el siguiente",es,0
"En fait, vous pourriez lire entre les lignes de votre personnage préféré et voir comment elle a regardé dans cette vidéo pour le premier",fr,2
"Il sindaco di Sydney ha detto che sosterrà ""assolutamente"" l'""amore duro"" dei gay.",it,2
"Die New York Times berichtete am Mittwoch, was eine schnelle Entschuldigung von der Regierung für ihre ""systematische"" Vertuschung auslöste.",de,0
"Un uomo e' stato arrestato per un reato minore in relazione a una sparatoria nel centro della citta', domenica pomeriggio.",it,0
"Un paio di giorni fa ho visto questo video su come la FDA ha cercato di regolare la marijuana, e ho avuto una sensazione simile quando",it,0
"""Je veux vraiment voir cela se concrétiser. Ça fait si longtemps que je n'ai pas joué ici.",fr,0
"Eier sind eine gesunde, nahrhafte, gesunde Art zu essen, die für Sie und Ihre Familie und das ist genau die Art und Weise, wie es ist",de,2
"
The following is an excerpt from a news article by the Federal Bureau of Investigation (FBI) that I've written about extensively in the past:",en,2
"Wenn ein Schüler in eine Schule geht, hat die Schule ein paar Dinge im Kopf. Für den Anfang, sie suchen einen Weg, um",de,1
MOSCOW (Reuters) - Le président américain Donald Trump a déclaré mercredi qu'il ne chercherait pas de nouvelles sanctions contre la Russie pour son rôle,fr,0
Un nuovo studio sull'impatto del riscaldamento globale sull'uso dell'acqua da parte delle specie mostra che un numero crescente di specie sta ottenendo molto più cibo da,it,2
Ich habe ein Problem mit diesem Rezept. Es macht meine Haut dunkel aussehen. Es macht meine Haut weiß aussehen. Es macht meine Haut schwarz aussehen,de,0
"I'm not an academic, but I'm a professor, so I'm probably doing my best to make it possible for you to read this book",en,2
"Von TUSCALOOSA, Ala. - Die US-Staatsanwaltschaft für den Eastern District von Alabama",de,2
"Marijuana is considered a Schedule I drug under the Controlled Substances Act. It is a Schedule I substance, which means it is classified as a",en,1
"La Reserva Federal de Estados Unidos, uno de los bancos más grandes del mundo, está cumpliendo su parte del trato.",es,2
"L'uomo o la donna che non è un musulmano o che non è un musulmano non è un musulmano, e quindi il musulmano che non è un musulmano",it,0
"The man who killed two police officers in Baton Rouge, Louisiana last year was not mentally ill or insane, according to an arrest report obtained by the",en,0
"Quiero decir, no estoy seguro si estamos hablando del juego real o sólo del juego en sí.",es,0
"„Die Art und Weise, wie unsere Regierung mit Ihrer Privatsphäre umgeht, ist nicht akzeptabel"", sagte die Erklärung. „Die Regierung darf die Menschen nicht zwingen, persönliche Dinge zu tun.",de,0
"""Non ci sono regole o regolamenti,"" ha detto Steve Rucker, direttore della politica per l'Unione delle Libertà Civili Americane del Kentucky. ""Non c'è niente",it,0
Ascoltare un oratore ad un evento pubblico sulla Corea del Nord è spesso sufficiente a causare un grande shock nei media del paese.,it,1
"""My dad was a big fan of it, and he told me to keep it,"" he said. ""I told him, 'I think",en,2
La Liga Nacional de Fútbol (NFL) tiene mucho que aprender sobre las nuevas reglas de la NFL.,es,2
Diese Website ist ein eingetragenes Warenzeichen der Creative Commons Attribution (CC BY) 4.0 International License (http://creativecommons.org).,de,2
", la société qui le fait, est la première à soutenir le nouveau logiciel. Il a également récemment dévoilé une version gratuite qui est disponible à télécharger pour",fr,2
"Dieses Tutorial ist ein wenig fortgeschrittener als die, die Sie oben sehen. Es wurde entwickelt, um am Ende des Tages verwendet werden, aber Sie",de,1
"Los Estados Unidos han impuesto sanciones a la Federación de Rusia por su participación en la crisis de Ucrania, y se han comprometido a castigar a Moscú por su papel en la lucha contra el terrorismo.",es,2
"Una mujer que fue asesinada por su novio después de que se enfrentaron en un bar en el este de la ciudad terminó con una lesión grave en la cabeza, el juez",es,0
"Me gusta pensar en mí mismo como un escritor. Solía ser bastante bueno en esto. Mi escritura es siempre divertido, interesante, y divertido",es,2
"El segundo día del torneo anual de Liga Femenina División Uno Liga Femenina, en el Wells Fargo Center en Filadelfia el jueves 28 de julio.",es,2
"US-Militärbeamte sagten am Montag, dass das Pentagon mit der syrischen Regierung verhandelt hat, um die Kämpfe zu beenden, und dass sie einen Waffenstillstand erwarten",de,0
"Die jüngsten Enthüllungen über die Verbindungen der CIA zur Bush-Administration, wird das Senats-Geheimdienstkomitee voraussichtlich über einen Bericht berichten.",de,2
"""Non ho intenzione di portargli via niente, e non ho intenzione di portargli via niente.",it,0
"Das Finanzkomitee des Senats wird eine endgültige Abstimmung erhalten müssen, bevor es sich darauf vorbereitet, den Plan der Trump-Administration zur Neuverhandlung der nordamerikanischen",de,0
GPS: Diese Seite wird nur auf die neueste Version von iOS aktualisiert. Diese Seite wird nur auf die neueste Version von iOS aktualisiert.,de,0
"
A few weeks ago, I wrote a blog post about how to create a ""big data"" solution that has a lot of benefits for user",en,2
"1 Die Zahl der Personen, die sich in den letzten fünf Jahren für die Wahl angemeldet haben, wobei die größte Zahl diejenigen ist, die sich für die letzten fünf Jahre angemeldet haben.",de,2
"Il governo federale sta cercando di regolare la vendita e la distribuzione di marijuana negli Stati Uniti, secondo i rapporti dei media.",it,2
Une nouvelle étude sur l'impact du changement climatique sur l'économie américaine a révélé que les plus grands moteurs économiques se trouvent aux États-Unis.,fr,2
One of the biggest changes to the way we treat our guests is that they're supposed to be having a good time. Some guests will be spending,en,1
3.2.4 Modifiche ai dati 3.2.3 Correzioni di bug 3.2.2 Correzioni di bug,it,0
"""Je ne vais pas aller à la Maison Blanche pour rencontrer le président Trump,"" a déclaré la mère de 45 ans de trois, qui",fr,1
Une enquête du gouvernement britannique a conclu que le Royaume-Uni devrait payer davantage à l'Union européenne pour l'aider à faire face à la crise des réfugiés dans le pays.,fr,1
GitHub Entwickler GitHub Entwickler sind Teil der Gitter Community und konnten die Community Features der Community nutzen,de,2
"Gli Stati Uniti stanno affrontando una crisi economica, con una disoccupazione del 4,9% in febbraio e un anno dopo le elezioni di novembre.",it,0
1-800-234-9090 1-800-619-1260 2-800-222-8348,de,0
"Cinquant'anni fa, la Corte Suprema degli Stati Uniti ha deciso che lo Stato deve chiarire che il diritto di una persona alla privacy è",it,0
"Una foto publicada por la campaña Clinton muestra a Hillary Clinton, la candidata presidencial demócrata, y su esposo, el ex presidente Bill Clinton, en Nueva York",es,2
"J.C. Penney sagte, er habe vier Jahre mit der örtlichen Polizei gearbeitet, was er sagte, dass er eine ""häufig"" grobe",de,1
"L'ultima volta che ho visto la parola 'riforma' usata contro un uomo è stato durante la campagna per abrogare la legge sulla cura a prezzi accessibili, che è stato",it,0
"Evaluating the cost of a ""transitional tax credit"" on incomes below $50,000:

The average tax credit is $",en,2
"
The New York Times is going to miss this one.


The Times writes, ""The Senate Intelligence Committee is probing whether Russia's election",en,0
"""E' passato molto tempo da quando ho avuto un lavoro in una di queste industrie. E' da un po' che non ci lavoro.",it,0
"I due uomini che hanno cercato di rapinare la banca sono stati giudicati colpevoli da una giuria di rapina e cospirazione, secondo la CNN.",it,0
".

.

.

.

.

.

.

.

.

.
",en,0
"
This is the main part of the story.

In a world where everything is in flux, how will the world of the future look",en,2
"La próxima generación de juegos para PC se puede encontrar en la nueva Microsoft Store, donde se puede descargar una copia gratuita de Borderlands 2, Borderlands:",es,2
"Sappiamo che i nostri cuori si raffreddano, non e' la settimana piu' fredda dell'anno, e' il periodo piu' freddo dell'anno.",it,1
Un ancien conseiller principal pour la sécurité du président Barack Obama a déclaré mardi que le gouvernement a « fait une erreur » en laissant des gens dans le noir.,fr,0
"La prima delle tre partite del draft NBA 2013, i Los Angeles Lakers hanno vinto il premio NBA Rookie of the Year 2013, il terzo",it,2
"
""We're not the first to find out this kind of thing, but it's pretty much the norm in the industry,"" he says.",en,1
"Il Black Lotus, l'auto che penso sia stata la parte piu' divertente del mio viaggio in Cina nelle ultime due settimane.",it,2
"In diesem Artikel konzentrieren wir uns auf die erste Woche, die erste Hälfte und die zweite Hälfte 2016, und wie einige der neueren Entwicklungen",de,2
"Die neuesten Beweise für eine Verbindung zwischen dem Zika-Virus und Autismus stammen aus einer neuen Studie, die in der Zeitschrift Science Translational Medicine veröffentlicht wurde.",de,2
A few weeks ago I started a new blog where I explain how I've been using Python and how to get started with it. Today I'm,en,2
"He tenido un par de problemas con la configuración de los gráficos en mi PS4, y no estoy seguro de por qué.",es,0
"Sanchez è stato arrestato il 6 dicembre 2011 per l'omicidio della sua ragazza,",it,0
"This page is about the character. You may be looking for:

A character who is in early access and is a member of the Dark",en,2
Ein ehemaliger New Yorker Polizeibeamter plädierte für schuldig am Freitag zu einem Verbrechen Graf der illegalen Verwendung einer Feuerwaffe in der Kommission eines Verbrechens.,de,0
"J'étais un enfant, je les ai vus au cinéma au lycée, parfois j'avais un rêve pour être un super-héros, mais je pouvais",fr,1
The Department of Homeland Security has asked Congress to make changes to section 2 of the Patriot Act that requires all military personnel to disclose the identity of national,en,0
. . . . . . . . . . . . . . . . . . . . . . . .,de,0
"
FIND THESE REBELS

Get a FREE copy of this book before you buy!!

The Ultimate Guide to the Book of",en,2
"
""I'm sure we will learn from this,"" said U.S. Rep. Tom Cole (R-Coleville). ""We will",en,2
"Pour plus d'informations, veuillez consulter : Le nouveau gouvernement américain et la nouvelle économie américaine La nouvelle économie américaine est une organisation internationale",fr,2
"L'ultima volta che ho visto la band è stato nel 2010, quando hanno suonato il loro secondo album, The Black Mamba.",it,2
Voici un extrait d'un discours prononcé à l'Université de Caroline du Nord à Chapel Hill le 21 mars 2013.,fr,2
"Eine kleine Anzahl amerikanisch geborener Christen wurden wegen Unterstützung des Islamischen Staates in Syrien verhaftet, ein Bericht des Southern Poverty Law Center (SP)",de,0
Il ne s'agit pas d'aller à la salle de gym. Il s'agit d'aller à la salle de gym.,fr,0
Il governo degli Stati Uniti ha rivelato che il governo vuole espandere l'uso dei droni sul suo suolo. Il programma dei droni è attualmente in fase di revisione da parte di,it,2
"El segundo de una serie de ocho documentales sobre la década de 1980, ""El mayor perdedor"", ""El mayor perdedor"", y",es,2
"Die weltweit größte Bank ist bereit, Milliarden Pfund für ein neues US-Super-Fast-Track-Netzwerk zu zahlen, das es ihr ermöglichen könnte, auf einem",de,2
Die Polizei von D.C. verhaftete einen Mann nach einem Einbruchversuch in einem U-Bahn-Bus.,de,0
Lo primero que necesitas saber sobre esto es que no es una secuela de The Witcher 3.,es,1
"2-5-1 - 2-5-1 Nell'anno 2015, il tasso di disoccupazione del Regno Unito è superiore a",it,0
Wachstumsraten für High School Teachers Quelle: Department of Labor Die Wachstumsraten für High School Teachers sind vergleichbar mit denen für,de,1
"Dans un nouveau rapport, le ministère de la Justice des États-Unis (MAJ) a publié un rapport sur la « guerre contre les drogues » dans lequel",fr,1
"The US government's new push for a military intervention in Syria will undoubtedly have its first impact on the region, but its implications remain unclear.
",en,1
"""Il problema è che il governo ha mostrato la volontà di dare l'illusione di non poter controllare il mercato. ""Oggi,",it,0
Un gruppo di attivisti ha lanciato una campagna per convincere il governo degli Stati Uniti a chiudere la raccolta all'ingrosso della National Security Agency di tabulati telefonici e,it,2
"Un grupo de investigadores ha estado trabajando durante décadas para desarrollar una nueva forma de medir la densidad energética del aire, que se puede utilizar para ayudar",es,2
"The most common type of cancer is prostate cancer, which is often associated with skin cancers, the most common prostate cancer, with a few rare cases",en,1
"TAMPA — The Tampa Bay Lightning have acquired defenseman John Tavares from the Colorado Avalanche.

Tavares, 25, has been",en,2
"
A couple months ago, I wrote about how people in the industry were looking for a way to have their product in a more mobile-friendly",en,0
Il Dipartimento di Stato degli Stati Uniti è stato coinvolto nel processo diplomatico tra Egitto ed Egitto lo stesso giorno in cui l'esercito egiziano ha sparato un missile in,it,0
"AUSTIN (AP) — El gobernador republicano de Texas, Greg Abbott, dijo el lunes que vetará una medida que permitiría a los votantes de Texas optar por",es,1
1.4.1 Fehlerbehebungen und Leistungsverbesserungen. * Verbesserungen an der Spielweise. * Einige Fehler behoben und,de,2
"""Ich werde nicht sagen, dass es kein Problem war, aber es war ein Problem, das behoben werden musste"", sagte er.",de,1
"Eine neue Studie von Forschern der University of British Columbia deutet darauf hin, dass die Menge an Kohlendioxid in der Atmosphäre schneller steigt als in Tausenden von Jahren",de,2
"Les électeurs, vous avez peut-être remarqué que les sondages ne vont pas très bien. La Nate Silver de Washington Post a rapporté que la dernière enquête nationale avait",fr,0
"Se espera que la próxima fase de la operación militar israelí para expulsar al ISIS de Cisjordania comience pronto, dijo un alto funcionario militar israelí el sábado",es,1
"- Una línea de ferrocarril de alta velocidad está en construcción en la ciudad de Fort Wayne, Ind., que se espera que cueste casi $2 mil millones.",es,2
"La Marina de los Estados Unidos ha llevado a cabo dos desembarcos masivos en el Océano Pacífico frente a Japón y Japón, con el primer desembarco en 2013",es,2
"Ho giocato con il potere di questo mod e non riesco ad avere quella sensazione che non funzionerà, così ho deciso",it,1
"Se sei un fan del gioco, ti piacerà questo gioco tanto quanto me. E 'un gioco di combattimento a turni dove",it,2
"Ich bin auf den Boden gegangen, und da stand der große Kerl da. ""Sieh dir den an, er ist ein Mann.",de,0
"
The latest version of the Linux kernel supports 64-bit architectures and most of the desktop environments and applications on the desktop.

Windows
",en,2
"Para ver lo que estaba sucediendo en la capital de Estados Unidos a finales de la semana pasada, echa un vistazo al siguiente vídeo.",es,2
". La primera mitad de la temporada fue una lenta para los Rojos, con lesiones a la mejor perspectiva Max Tresel (hamstring",es,0
"JACKSONVILLE, Fla. - Un lanzador de Tampa Bay Rays ha sido suspendido tres juegos por violar la política del equipo en un golpe de liga menor.",es,0
"Im ersten Quartal 2016 war die Zahl der Amerikaner, die ihr Einkommen meldeten, um 5,4 % niedriger als im gleichen Zeitraum im Jahr.",de,0
"Ich schaue mir seit einer Weile die beliebteste Anime-Serie der Welt an, und ich habe endlich die Zeit, in diese Serie einzutauchen.",de,2
"WITH TEN MILLION THINGS WE CAN TALK ABOUT, PEOPLE WILL SAY: ""I'm totally open to it"". That's true",en,0
Danish police said on Friday they were searching for two black men believed to have been involved in a theft in a street in the Danish capital.,en,0
Feliz Navidad a usted! Gracias por leer! Espero que haya disfrutado de esta crítica! Este es el primero de muchos,es,2
/\/\/\/\/\/\/\/\/\/\/\/\/\/\/\/\/\/\/\/\/\/\/\/\,fr,0
"Saluti, e benvenuti al World of Warcraft Companion. Il World of Warcraft Companion è l'enciclopedia definitiva dell'universo Warcraft.",it,2
"Lo primero que hay que tener en cuenta es que en los últimos meses, Apple ha hecho muchos cambios en su plataforma App Store, que ha sido un enorme",es,2
"Questo articolo è circa la storia. Potreste essere alla ricerca del capitolo ""nordic"" nella serie. Questo articolo è circa.",it,2
"Das US-Department of Homeland Security hat eine Warnung herausgegeben, dass alle US-Arbeiter bis zum 1. Oktober entlassen werden sollten, wenn sie erwischt werden, arbeitend",de,0
"There's a lot to worry about in the NFL, and for good reason. It's not just about playing the game on a huge stage.",en,1
". Come nota secondaria, l'idea di un ""programma di povertà"" non è nuova. Quando ero al college, un amico",it,0
"
SALT LAKE CITY — The Mormon Church has been accused of a string of child sex abuse scandals over the years in Utah, and its",en,2
No tengo idea de por qué los autores son tan despistados sobre la ciencia detrás de la teoría. Creo que esta es la primera vez que han incluido un,es,0
Stanco di sentire il numero di volte che abbiamo sentito di bambini a cui è stato diagnosticato l'autismo (e che ora stanno imparando a parlare inglese),it,0
"Non stiamo nemmeno cercando di fare un sacco di soldi, ma non stiamo nemmeno cercando di fare un sacco di soldi.",it,0
"Una mujer resultó herida cuando fue apuñalada por un hombre fuera de un centro comercial en el distrito de la ciudad el miércoles por la mañana, dijo la policía del distrito.",es,0
Conseguenze del trattato di pace interinale L'accordo finale sarà probabilmente definitivo a breve. Gli Stati Uniti e i loro alleati continueranno,it,1
"Le New York Times a rapporté dimanche que le gouvernement américain enquête sur la société qui possède le Times et comment il a utilisé son ""anti-",fr,0
Il più grande mercato mondiale di esportazione di gas naturale è nel bel mezzo di un massiccio boom di nuove attività. Ma l'industria del petrolio e del gas rappresenta solo la metà,it,0
The man accused of killing four people in a nightclub in Paris on Friday is believed to be a former Paris prosecutor who was linked to the deadly attacks,en,0
"Il semble que tous les médias ""anti-Trump"" étaient tout aussi soucieux de diaboliser Trump que les gens qui le soutiennent.",fr,0
"Trying to get someone to stop the car from driving under your influence, but then driving under your influence, you can lose a lot of control",en,1
"Hay tres razones principales por las que un empleador debe optar por contratar a un contratista calificado, internacionalmente calificado, sin fines de lucro para un proyecto a un costo",es,0
"(CNN) Un homme a été abattu par la police à l'arrière de la tête dans le centre-ville de Seattle mardi, a dit la police. L'homme,",fr,0
"
A person who has been arrested for child trafficking, or who is suspected of trafficking, has been charged with child pornography, child pornography, child",en,0
4. La Asociación Americana de Abogados (ABA) afirma que la Liga Nacional de Fútbol (NFL) está en violación de la Liga Nacional de Fútbol de los Estados Unidos (,es,0
"Le New York Times a rapporté en avril que l'administration Trump avait ordonné que le meilleur conseiller contre le terrorisme du gouvernement, Michael Flynn, soit retiré de son poste.",fr,0
"Hay muchas maneras de compensar el tiempo perdido, pero un buen método es trabajar en su tiempo. Sé que es difícil",es,1
"Se vuoi comprare una casa, devi sapere per cosa stai pagando. Non è una semplice questione di trovare il giusto prezzo",it,1
"
It's not easy seeing how the Republican party has become more and more resistant to the idea of cutting spending and spending more in order to raise",en,0
A bill passed in the Illinois House of Representatives would allow anyone who has a concealed carry permit to carry a firearm in violation of the city's gun,en,0
"
Today, I got to sit down with a few of my favorite writers for an interview. I asked them to share their favorite stories from the",en,2
L'ultimo aggiornamento di Windows Phone 8 Update porta su molti aggiornamenti e correzioni di bug. Questo include alcuni miglioramenti per le versioni di Windows 10 Mobile e Office,it,2
"Il y a un peu plus d'un mois, j'ai reçu un tweet d'un commentateur qui disait que ""J'ai une nouvelle idée pour un nouvel album.",fr,0
"
The National Transportation Safety Board has ordered a new safety-related data breach that resulted in a loss of more than $11 million in safety-",en,0
"""Es gibt eine Menge Fehlinformationen über die Kosten von Impfstoffen,"" sagte Dr. David Schatz, Direktor des Nationalen Zentrums für Immun",de,0
"Preghiera per un nuovo ""Re malvagio"" che è stato accusato di avergli rubato una chiave, e il ""Bounty"" della sua famiglia.",it,2
Le dernier cycle de financement de l'administration Trump a été réservé à la « recherche et développement ».,fr,1
"
For the first time in years, a single mother in Indiana will be able to pay for her monthly maintenance fee.

The state's",en,2
"Il sito ufficiale per il prossimo progetto, il ""Super-Earth Exorcist"" è stato annunciato mercoledì. Il film è destinato ad aprire il",it,2
"J'ai des problèmes avec mon client de jeu, et il semble fonctionner bien. J'utilise le même client de jeu que le client de jeu sur",fr,2
"Somewhere in the middle is a woman who is so small and yet so tiny, that she is almost at the size of a human.",en,0
La seguente sezione farà riferimento ai dati raccolti per questo studio. Sono state raccolte informazioni sui seguenti:,it,2
"Das Parlament stimmte am Dienstag für die Aufhebung des ""Affordable Care Act"", und der Senat stimmte über einen Gesetzentwurf ab, der die Fähigkeit der Bundesregierung, Anklage zu erheben, beenden würde.",de,0
", por David L. Schoenberg, 12 de enero de 2016, 15:04:38 El video comenzará en 8 Cancelar",es,0
"Per ulteriori informazioni, visitare il sito http://www.doucetarel.com o chiamare l'1-800-DOUC",it,2
2.12.0 - Risolto un problema con il pulsante di download nel menu principale - Risolto un bug con il pulsante di download,it,0
El FBI ha abierto una investigación sobre cinco sospechosos en el bombardeo del Maratón de Boston.,es,2
"Ich habe diesen Blog seit dem letzten Tag gelesen. Ich war in der Turnhalle, um zu trainieren, und ich bin in der Turnhalle gewesen, um",de,2
"New Delhi : Le gouvernement a lancé sa stratégie technologique nationale (SNT) pour les quatre prochaines années, en définissant le gouvernement",fr,2
"
A new report by the US Department of Transportation shows that the United States still has more traffic violations than the UK in 2017, with an average",en,1
"A principios de la década de 1990, una nueva raza de jugadores profesionales de béisbol comenzó a abrirse camino en el juego.",es,2
"""L'idea che continueremo a costruire lo stesso tipo di infrastrutture che è stato fatto con l'infrastruttura del passato è stata una",it,0
"""I'm worried about the future of the world,"" he said. ""A lot of people are going to lose jobs and a lot of people",en,0
Un nuevo estudio revela que las mujeres que están expuestas a la marihuana en el útero tienden a tener infecciones vaginales graves y prolongadas.,es,1
Colgo l'occasione per ringraziare tutti coloro che mi hanno sostenuto e mi hanno aiutato a passare attraverso questo difficile periodo.,it,2
Si eres un niño que crece en los suburbios y tienes una familia en un edificio de apartamentos y te lo han dicho tus profesores de escuela,es,2
1 #1 mwsofficial - 1 Frags + ho giocato a questo gioco per alcuni anni e sono molto,it,2
