tweet,language,labels
J'ai toujours été un fan de la série Naughty Dog et j'adore le fait qu'il ait une équipe forte derrière elle.,fr,2
"Sara Poythress, una escritora del New York Times. En una entrevista con Salon, la primera opción de Trump en el",es,0
Cape Town - La South African Football Association (SFA) enquête sur un incident potentiel impliquant un joueur sud-africain qui tentait de rejoindre un,fr,1
"Todavía no hay mucho que puedas hacer sobre el reciente ascenso de la derecha-alt, pero hay algunas cosas que puedes hacer para ayudar",es,1
"Von John B. Sibilotta, A.T.B.P., Ph.D., Assistant Professor of Electrical Engineering, University",de,2
El UESPWiki – Su fuente para los Pergaminos de los Ancianos desde 1995 Fragmento de los Nalgis Un pequeño pero,es,2
"Architecture de réseau flexible et sécurisé Nous nous engageons à faire en sorte qu'un réseau sécurisé, sécurisé et flexible soit construit en plus des réseaux existants.",fr,2
"In a letter to the editor of the New York Times, Robert Costa, the New York Times' president, called on the publication to ""stop",en,0
C'est une histoire très intéressante et qui a été écrite par une personne très bonne et intelligente.,fr,2
La última ronda de legisladores estadounidenses se ha convertido en una pesadilla política para la Agencia de Seguridad Nacional.,es,0
"
I know what you're thinking: I just read a bit about the history of the ""puppet"" theory, but I'm sure you",en,2
Se le ha acusado de ordenar el asesinato de una mujer que había detenido en un bar en un intento de rescatar a su marido de la,es,1
"Vous pouvez même utiliser le même personnage pour passer des messages. Le seul problème est, vous ne connaissez pas la langue, et vous ne le savez pas",fr,1
"La última en la actual saga de la agencia de espionaje estadounidense que ha sido expuesta como una agencia masiva y secreta, la agencia fue",es,2
"La segunda edición de la popular serie de Los Simpsons, Los Simpsons: Los Simpsons para Niños, está recibiendo una nueva serie spin-off.",es,2
"La première étape est de s'assurer que nous avons tous les documents correspondant à votre nom et adresse. Une fois que vous avez fait cela, vous aurez besoin",fr,1
L'ex direttore della Central Intelligence Agency degli Stati Uniti si è dimesso dopo che l'agenzia ha rilasciato documenti declassificati che hanno detto che l'agenzia aveva raccolto e memorizzato grandi quantità di,it,0
"Einer der wichtigsten Aspekte des Lernens über das Universum ist das Verständnis, wie das Universum funktioniert.",de,2
"Die Idee einer ""kleinen"" vierköpfigen Familie, die in einem kleinen Haus in Los Angeles mit zwei Kindern lebt, mag sicherlich nicht so aussehen.",de,1
. . . . . . . . . . . . . . . . . . . . . . . . . . . . . . . . . . . . . . . . . . . . . . . .,fr,0
"
The first time I heard about the new Nexus 5 was in late June, and it has been a while since I've used it. So",en,1
Amanecer-Amanecer - El Día del Dragón - El Dragón en el Fuego - Uno de los suyos - El Dragón en la Noche -,es,2
"Bethany Houghton, un ex congresista demócrata de Kansas, fue arrestado bajo sospecha de poseer $5,000 en efectivo para comprar un",es,0
"Tottenham sind bereit, einen der Top-Free-Agenten im Jahr 2016 zu unterzeichnen Everton muss vielleicht bis 2017 warten, um einen Spieler für",de,1
"Die Obama-Administration wurde gezwungen, den Verkauf eines neuen Raketenabwehrsystems für eine Weile auszusetzen, aber das US-Militär hat",de,0
Di seguito è riportato un breve elenco di modi in cui uno o più di questi elementi possono aiutare e ostacolare la vostra salute.,it,2
Una foto rilasciata il giovedì mostra un uomo con una pistola nel parcheggio di un ristorante all'angolo di South Park e Main Street a Los Angeles,it,0
"""Se non fosse stato per la presenza di alcune delle persone più belle della Terra, non credo che avremmo parlato di",it,0
"J'ai beaucoup entendu cette histoire récemment, et l'essentiel est que si vous voulez juste ""voler"" votre jeu, vous devriez jouer",fr,2
"Il primo, il primo. ""Penso che se avessi avuto l'opportunità, avrei fatto la stessa cosa,"" Kuznets",it,1
"La deuxième et dernière fois que la première saison de Game of Thrones est sortie, les créateurs de l'émission ont été obligés de faire une grosse affaire",fr,0
"
The official website of the state's government on Wednesday said the government would work with local authorities to create a ""crisis management system"" in",en,0
"""Du kannst nicht einfach zu einem gehen und sagen: ""Ich will, dass du zurück ins Hotel gehst"", du musst in ein anderes Hotel gehen.""",de,0
"La Cámara de Representantes y el Senado aprobaron el martes un proyecto de ley que permitiría a las personas transgénero usar el baño que corresponde a su sexo natal,",es,0
"En mayo, el gobierno federal anunció que había lanzado una ofensiva contra la piratería en línea. ""El gobierno de Canadá y otras jurisdicciones han tomado",es,0
C'est presque impossible de dire qui fait quoi. C'est parce que beaucoup des joueurs les plus puissants dans le jeu ne sont même pas conscients,fr,1
"El camino más probable hacia el éxito es desarrollar y comercializar un producto que sea asequible, atractivo y accesible para los consumidores. ""Creo que",es,2
"I am not the only one who is aware of the difference between the two. I recently wrote about it in the article ""Why Do We Need",en,0
"Le nombre de personnes ayant accès à un service offert par le NHS est passé de 6,5 millions en 2012/13 à 3",fr,0
"Der U.S. Postal Service untersucht eine Post-in-Verletzung, die in seinen Einrichtungen in Portland, Oregon aufgetreten ist.",de,2
"""Dovrò esaminare tutte le opzioni e decidere quale userò,"" ha detto. Gli sarebbe stato permesso di",it,1
"The world's top 100 most expensive companies have been ranked by Forbes as the world's most profitable companies in terms of annual revenue, according to a",en,0
"Iba a hacer algo loco hoy, pero tenía que hacerlo bien. Empecé a cansarme de la idea de cómo hacerlo.",es,0
"La primera pregunta que le hice a mi esposa sobre su último proyecto fue: ""¿Haces algo?""",es,0
"Wie ich bin sicher, Sie haben gehört, das war der Fall mit der ursprünglichen Version des Spiels, die auf dem PC veröffentlicht wurde.",de,2
"Giants are desperate to find a replacement for David Perron.

Perron, a first-round pick out of Arkansas, is reportedly",en,1
"Die zweite Generation der Apple Watch ist ein am Handgelenk getragenes Gerät, das von der ersten Generation entwickelt wurde, um als Smartwatch verwendet zu werden.",de,2
"- - Si utiliza esta guía para obtener la información correcta sobre el tipo de juego adecuado, por favor, consulte la guía para",es,1
"La dernière fois que la LNHPA a proposé de remplacer la convention collective actuelle de la LNH par une franchise d'expansion, c'était avec les Flyers.",fr,0
"Parks und Erholung Der Park verfügt über 10 Parks und Erholungsgebiete, jeweils mit einer anderen Funktion. Wir empfehlen Ihnen, alle zu sehen",de,2
"Una imagen muy temprana de la Estatua de la Libertad. La Estatua de la Libertad y la Estatua de la Libertad son dos de las más antiguas, más importantes",es,2
"Una recente indagine ha rilevato che solo l'8% degli americani ha sostenuto il matrimonio omosessuale, rispetto al 46% che vi si opponeva.",it,0
La deuxième manche des séries éliminatoires a beaucoup d'incidences pour les Blackhawks. Les Blues sont l'équipe qui a le plus de temps de glace de n'importe quelle équipe,fr,1
"Wake Forest, una nueva ubicación en el noroeste de Portland, ha sido el sitio de un gran incendio en los últimos años.",es,0
Die erste von zwei großen Studien zur Untersuchung des Zusammenhangs zwischen Nahrungsfettaufnahme und Mortalität bei Männern und Frauen wurde im American Journal of Epidemiology veröffentlicht.,de,2
"Die beiden Teams, die in den NBA Playoffs 2016 spielen werden, sind die Utah Jazz und die Portland Trail Blazers. Die Trail Blazers haben gewonnen",de,2
"Cuando veas un programa de televisión, descubrirás que a menudo es lo más importante del programa.",es,1
"Los he visto en acción, han demostrado ser eficaces de varias maneras.",es,2
L'indagine dell'FBI sui contatti della campagna di Trump con la Russia è iniziata. L'FBI ha annunciato mercoledì che ha aperto un'indagine sulla Russia,it,1
"""La manera de ser un buen tipo en el mundo es ser algo así como en su mundo. No voy a mentirte.",es,2
"In einem Artikel der New York Times wird beschrieben, wie ein junger Mann von einem weißen Suprematiker, der sich als Kinderdarsteller entpuppt hat, zu Tode gestochen wurde.",de,2
"BANGALORE: Ein leitender Beamter des indischen Ministeriums für Kultur und Sport wurde verhaftet, weil er angeblich ""antisozial"" begangen hat.",de,0
"- Si vous voulez en savoir plus sur ce sujet, suivez le lien à droite et lisez la vidéo ci-dessous.",fr,1
"La società che possiede l'iPhone e iPad, Apple, è stato accusato di utilizzare un ""programma di terze parti"" per spiare i suoi utenti",it,0
Das U.S. Department of Education hat eine Anleitung für Studenten zur Vorbereitung auf das College herausgegeben.,de,2
"Eine Frau wurde getötet und ihre beiden Kinder verletzt, nachdem am Sonntagabend ein Auto auf einer belebten Straße im Westen Londons in Fußgänger gepflügt wurde.",de,0
"Virtue, a digital music company, is looking to build a ""vital part"" of their music catalog by building a collection of music",en,2
Le dernier numéro du New York Times présente un certain nombre d'histoires sur le profilage racial.,fr,1
(Reuters) - US-Bezirksrichter James Robart am Donnerstag erklärte einen Fehlprozess beim Tod des 19-jährigen Matthew,de,0
"En consecuencia, está aumentando el número de personas que no son religiosas o que no creen en la religión.",es,0
"Nanotecnología se ha utilizado para impulsar nuestra salud y nuestra sociedad durante mucho tiempo, pero la mayoría de nosotros queremos saber lo que es",es,2
"Il 28 agosto 2017, il Dipartimento di Giustizia degli Stati Uniti ha annunciato che avrebbe lanciato una revisione indipendente del controverso programma statunitense dei droni.",it,0
: A- B- C- D- E- F- G- H- I- J- K- L- M-,fr,2
La prensa canadiense ST. LOUIS -- Una nueva encuesta sugiere que la opinión política norteamericana está dividida sobre si la administración Trump debería,es,0
"È possibile, ma altamente improbabile, che nei prossimi tre anni, il pubblico sarà in grado di scoprire se questo è davvero un problema",it,1
"La première fois qu'on en a entendu parler, on nous a dit qu'il s'agirait d'une libération majeure.",fr,0
"Die USA haben zwei ""Notstands""-Kräfte, die sie gegen den Islamischen Staat Irak und die Levante einsetzen können.",de,2
"""La cosa migliore che possa mai accadere al mondo è che alcune persone cambieranno idea e diranno:",it,2
"Taken from the book of Balthazar (1st Edition) by Walter A. Moore, The Book of Balthazar (B.",en,2
"Geplant, um nächste Woche vor Ende des Jahres zu eröffnen, wird das neue Gebäude einen neuen, Doppeldecker-Bahnhof umfassen,",de,1
"""Molte persone dicono: 'Oh, beh, non ne abbiamo mai sentito parlare prima,' ma non lo sappiamo.",it,0
"Alors que l'été 2015 s'achève, c'est un bon moment pour rattraper les grandes histoires du monde entier.",fr,2
"A finales de la década de 1990, el número de mujeres que trabajaban en la industria minera en Canadá descendió a menos del 1%.",es,0
"Estoy deseando pasar un rato rápido, divertido y divertido con mi familia. Se siente muy bien ver a nuestra hermana y a mí juntos.",es,2
"La ragione più ovvia per queste affermazioni è che il governo degli Stati Uniti è uno stato di marionette. Al momento, gli Stati Uniti.",it,0
Gardaíí must be careful not to give the impression that the case is a new one. The investigation has taken place for at least,en,1
"Die Regierung hat einen Antrag einer Unternehmensgruppe abgelehnt, einen ""Bürgerführer"" zu schaffen, wie man das Land durchquert.",de,0
"""E' una grande partita,"" ha detto Giorgio Chiellini, che ha vinto il campionato nazionale italiano nel 2003. ""Sono sicuro",it,2
. . . . . . . . . . . . . . . . . . . . . . . . . . . . . . . . . . . . . . . . . . . . . . . .,fr,0
"
This post may contain affiliate links. See our disclosure policy for more details.

This is a recipe for a quick and easy dessert.",en,2
von (LEGUNG DES LICHTS) Die folgenden Tatsachen spiegeln eine Auffassung des Rates der Europäischen Gemeinschaften wider.,de,2
"La première fois que vous voyez l'un de ces trois, vous pourriez ne pas être en mesure de dire lequel était celui que vous voudriez voir.",fr,2
"En este episodio del formato ""Ask Me Anything"", hablamos de cómo tener una muy buena conversación si no estás listo para """,es,2
"Die ersten beiden Staffeln der ""Duck Dynasty"" hatten einige der aufwendigsten und bizarren Handlungslinien. Die interessantesten Charaktere der Show wurden gespielt von",de,1
"Je n'ai aucune idée du nombre de personnes qui se sont plaintes de cet article, mais je sais que je ne suis pas du tout surpris par cet article.",fr,0
Un recente sondaggio del corpo studentesco nazionale ha scoperto che solo il 19 per cento degli studenti universitari nella nazione credono che il loro lavoro accademico è importante per loro.,it,1
"Basti dire che i principali giocatori del gioco sono un gruppo di persone che ci giocano da un po ', e che",it,1
"Der neue ""smart-money""-Plan der Bundesregierung, der am Mittwoch vorgestellt wird, dürfte für die USA ein großer Schub sein.",de,1
"Die neue Saison von ""The Vampire Diaries"" hat eine Reihe von bemerkenswerten Ergänzungen der Besetzung und Besatzung gesehen.",de,2
"
The best thing that's happened to the United States since the Civil War was the rise of the Tea Party. The Tea Party movement has been",en,2
Je ne sais pas si c'est dû au fait que j'ai une sorte d'allergie à ce truc ou peut-être quelque chose comme ça.,fr,0
"In questo post sul blog voglio parlare del concetto di ""agricoltura sostenibile."" Voglio parlare un po' di come possiamo usarlo",it,1
"
By Joe C. Korten

The New York Times

March 28, 2014

The National Rifle Association and the political",en,0
"WATERFORD -- Il sistema idrico della città sta lavorando per assicurarsi che sia sicuro per la maggior parte dei residenti, ma i funzionari non sanno ancora come",it,1
"(CNN) La Russia ha negato le accuse di aver interferito nelle elezioni presidenziali statunitensi del 2016 con la diffusione di email hackerate, una mossa che",it,0
Les États-Unis et l'Allemagne peuvent avoir un « moment spécial » dans lequel ils pourraient convenir d'un « accord de stabilisation » sur la Syrie qui pourrait,fr,1
"
It's like a good old-fashioned postcard: a note from the sender, some kind of message, and a picture of a few",en,2
Am Tag nach der Wahl schrieb ich über die Probleme mit der Wahl von Donald Trump in den Vereinigten Staaten.,de,0
"La siguiente es una lista de artículos recientes en los que he escrito sobre un tema determinado. El artículo no pretende ser exhaustivo, y",es,1
(CNN) Un homme de Caroline du Nord condamné à mort par un jury pour vente de marijuana dans la rue a été condamné à mort mais n'a jamais été confronté,fr,0
L'Assemblea Select Committee on Intelligence ha pubblicato la sua relazione martedì sull'hacking delle email democratiche da parte del Comitato Nazionale Democratico lo scorso anno.,it,0
"I've been doing a lot of research on this issue. I want to share some of the things I found out about this.

Why",en,2
"Dans ce billet, je veux mettre l'accent sur l'importance de veiller à ce que notre communauté soit éclairée par les résultats de notre travail.",fr,2
"""Ich bin dankbar für all die Unterstützung, die ich erhalten habe, und ich bin dankbar für die Art und Weise, wie ich mich verhalten habe"", sagte er.",de,2
Possibili motivi per cui l'azienda ha scelto di lavorare con Gage Hurdle: A. Devono essere in grado di mantenere un,it,1
Di seguito è riportato un elenco dei primi 5 siti web più popolari per il browser Internet Explorer. Questi sono i principali browser che consentono di visualizzare,it,2
"Pioneering: The Story of the New England Patriots' Winning Streak

By Dave Zirin

The New England Patriots have won",en,2
"
A team of researchers led by Professor Philip Latham of King's College London has successfully used the magnetic resonance imaging (MRI) of brain tissue",en,2
Un nouveau rapport de l'Institute for Policy Studies suggère que l'économie chinoise devrait croître à un taux annuel de 6% dans les cinq prochaines années.,fr,1
The Obama administration has been in negotiations to end the ban on travelers from seven Muslim-majority countries who face deportation under a new policy announced last week,en,0
"Es ist ein guter Tag, um ein Profi-Sportler zu sein. Letzte Nacht verloren die Chicago Bears ihr erstes Spiel in sechs Jahren. Es",de,2
Tampa Bay Lightning avant Tyler Johnson a marqué son premier but de la LNH dimanche soir après avoir marqué dans son premier match de la LNH. Johnson avait un but et,fr,0
Les derniers développements dans le cas d'un lycéen en Irlande du Nord demandant l'asile en Grande-Bretagne.,fr,2
"Nella prima delle tre interviste di mercoledi', Clinton ha detto che e' a favore di una candidata alla Corte Suprema che sara' la prima donna a candidarsi.",it,0
"Der Offseason-Plan der National Football League kann es schwierig machen, vorherzusagen, welche Teams im NFL Draft 2017 starten oder enden werden.",de,1
Non c'è bisogno di essere uno studente universitario per imparare a utilizzare questa applicazione. Se sei un junior che ha già utilizzato questa applicazione,it,0
"Tropical Storm Sandy, noto anche come Super Sandy, ha colpito gli Stati Uniti a marzo, inviando un uragano di categoria 3 nell'Oceano Atlantico.",it,0
"""It's a very important part of the game, it's a very important part of the game. We have the best team in the world",en,2
"""J'ai dit, ""Nous n'allons pas faire ça, nous allons le faire."" ""J'ai dit, ""Pourquoi serait-ce",fr,0
"Ich war in San Francisco, als ich in UC Berkeley war. Ich war kurz vor dem Abschluss von der Graduiertenschule. Ich hatte gerade mein erstes Jahr abgeschlossen",de,2
"BALTIMORE - Baltimore Orioles manager Buck Showalter said the club is still evaluating the options.

Showalter said he and the Orioles",en,2
", ce qui suit est une liste de tous les Pokémon connus utilisant le Dragon Shuriken , ainsi que la liste des mouvements les plus courants dans",fr,2
"U.S. President Donald Trump delivers his remarks during a meeting with South Korean President Moon Jae-in at the presidential palace in Seoul, South",en,2
La National Science Foundation e altre agenzie federali hanno accettato di pagare poco più di 13 milioni di dollari per risolvere una causa del Dipartimento dell'Istruzione (DOE),it,0
"""Questo è assolutamente il genere di cose di cui non possiamo fare a meno,"" ha detto. ""Dovremo mettere in atto un",it,2
La parte più importante del processo di avviare un'impresa è quello di costruire la fiducia. La fiducia è una parte chiave di qualsiasi attività.,it,2
A former US president and three other candidates for the Republican presidential nomination are set to be released from jail and face charges for allegedly conspiring to defraud,en,0
Il Dipartimento di Giustizia degli Stati Uniti (DOJ) sta indagando sul rilascio di un dossier segreto sulla campagna Trump che è stato ampiamente,it,1
Di Nick Reiter NHL Draft Note Sebastian Vettel ha annunciato che non firmerà un nuovo contratto con,it,0
Gli Stati Uniti sono l'unico partito al mondo ad avere una legge che impone sanzioni ai paesi che violano la sua sovranità. L'amministrazione Obama dice,it,0
"Das Weiße Haus reagierte nicht auf eine Bitte um Kommentar. Der Pressesekretär des Weißen Hauses Jay Carney sagte, das Weiße Haus würde nicht kommentieren auf",de,0
La Agencia de Eficiencia Energética y Energía Renovable del Departamento de Energía (EERA) se creó en abril de 2015 para tomar la iniciativa en materia de energía,es,2
"Nei giorni successivi agli attacchi dell'11 settembre 2001, il governo americano ha cercato di trovare il modo di aiutare le vittime.",it,2
Las pruebas del Tratado de Libre Comercio de América del Norte (TLCAN) se llevaron a cabo en febrero de 2017.,es,2
"L'ambasciatore degli Stati Uniti in Belgio, David Miliband, è stato accusato di ""cercare di giustificare"" l'azione del governo belga sostenendo che Bruxelles è",it,0
"El número de oficiales militares estadounidenses estacionados en el Medio Oriente, Europa y Asia ha disminuido precipitadamente en los últimos años, en gran medida debido a",es,1
"A study of American-born children in the United States reveals that young people from low socioeconomic backgrounds tend to have higher rates of mental health problems,",en,1
"The former top White House aide was a key ally of the president's campaign for the 2012 midterm elections.

The former aides said they were",en,1
La Corte Suprema il 16 febbraio ha abbattuto la legge dell'Illinois che vieta il trasporto di un'arma nascosta.,it,0
"In un rapporto che è stato presentato dal Dipartimento dell'Energia di Washington, D.C., l'agenzia ha detto che è previsto che ci sarà",it,1
"Beim ersten Mal waren meine Augen offen für einen Außerirdischen, sie waren direkt auf meiner Nase. Mein Gehirn wusste, dass es die Kreatur war",de,0
Le premier agent de police transgenre du Royaume-Uni est nommé dans une nouvelle vidéo montrant qu'elle est montée dans une voiture avec un homme puis s'est enfuie.,fr,1
Rand Paul (R-Ky.) et Ted Cruz (R-Texas) proposent d'abroger et de remplacer la loi sur les soins abordables comme,fr,2
"Con il rilascio del suo nuovo aggiornamento iOS 11.1 su febbraio. 11, l'azienda è riferito pronto per lanciare alcune nuove funzionalità",it,2
Tenete al sicuro i vostri figli Nessuno dovrebbe essere permesso di fare alcun rumore durante il sonno del vostro bambino. Il rumore sarà,it,2
"En fin de compte, la seule chose qui a réellement fait et permis que cela se produise est d'avoir beaucoup de gens entrer et de l'obtenir.",fr,1
"Vor etwas mehr als einem Jahr erhielt ich eine E-Mail von meinem lieben Freund, David Hickey, der gerade einen Master in Informatik abgeschlossen hat",de,0
"The number of people who have died from heart disease in the UK has climbed by more than 20% since the peak of the epidemic in 2009,",en,0
"""You will never do this,"" she said.

Fisher paused for a moment, then replied. ""Can't say I blame you",en,0
Un nuevo informe del Center for Disease Control and Prevention (CDC) muestra que más de cuatro de cada diez adultos estadounidenses,es,0
Une femme battue par un policier lors d ' un arrêt de police a été arrêtée pour avoir agressé un homme qui avait essayé de l ' arrêter.,fr,1
"La Corte Suprema de los Estados Unidos ha dictaminado que los estadounidenses que no están ""concientes del alcance de la vigilancia gubernamental"" no deberían ser capaces de",es,0
"
The Republican National Committee (RNC), the presidential campaign of Donald Trump, is facing a backlash from progressives.

The RNC has been",en,1
"Das Amerikanische Rote Kreuz (ARC) ist eine gemeinnützige Organisation, die sich an den Bemühungen der Organisation beteiligt, Frauen bei der Betreuung ihrer Kinder zu unterstützen.",de,2
"The Washington Capitals were up 5-0 when they took the ice against the New Jersey Devils on Friday, but they were already on a roll in",en,1
Usted ha cerrado sesión. Iniciar sesión  Registrarse Bryan Fischer ha sido un invitado en el espectáculo durante un tiempo. Asegúrese de comprobar,es,0
"Wir sind nicht sicher, ob es nur wir sind oder ob es eine Mischung aus beidem ist. ""Wir haben Leute in den Vereinigten Staaten, die",de,0
"In 2012, the American Enterprise Institute (AEI) was set up to evaluate whether corporations and government agencies can be trusted to follow the law and",en,2
El representante estadounidense Jason Chaffetz (R-Utah) está en medio de una sentada de dos semanas para protestar,es,0
"Ein Mann wurde verhaftet, weil er am Samstag an einer Tankstelle in der Wabash Street erschossen wurde.",de,0
"En este episodio del podcast, vamos a ver la primera parte de lo que hicimos para vivir, lo que aprendimos de la",es,2
"
The ""New World Order"" is already in an uproar over the massive growth of US influence in the Middle East and North Africa, which has",en,0
"Ich weiß nicht, wer den Film gedreht hat, aber ich werde dir etwas sagen, das ich schon mal gesagt habe.",de,1
Las conversaciones entre la Autoridad Palestina e Israel se reanudarán el miércoles en un intento de encontrar un acuerdo provisional para poner fin al conflicto israelo-palestino.,es,2
"Hace unas semanas, escribí sobre cómo la NSA y el FBI están en connivencia para atacar y hostigar a los estadounidenses musulmanes con el fin de hacerlos """,es,0
Creo que ese es un punto muy bueno. Hemos visto los resultados de nuestra propia investigación sobre este tema antes. No creo que los datos,es,2
"No es la primera vez que un candidato presidencial ha sido acusado de plagio, pero es la primera vez que la campaña de Trump",es,0
"La nueva versión del Archivo de Internet (FMI) se ha creado para mantener y preservar las colecciones históricas del dominio público, y",es,2
"La primera cosa que viene a la mente es que la política exterior del gobierno de Estados Unidos ha sido un desastre, y sin embargo eso es exactamente el",es,0
"Hay un montón de grandes cosas sobre un nuevo videojuego. Es divertido, es divertido jugar, y es divertido para",es,2
"Pelican New York Juan Carlos, und viele mehr. Pelican ist ein Nicht-",de,0
"Der Clean Power Plan der U.S. Environmental Protection Agency (EPA) soll in den Boden laufen, wenn er ablaufen soll.",de,2
