tweet,language,labels
"Nestlé Inc. a annoncé aujourd'hui son tout premier plan pour lancer son premier aliment « smart food », un produit « smart food ».",fr,2
"Qu'est-ce que c'est? Soyons réels. Combien de jeux ont-ils en commun? Quant à la note moyenne, vous pouvez voir",fr,1
"Je suis vraiment excité par ce livre. C'est un livre très bien écrit, et j'aime l'idée d'en faire une vraie affaire.",fr,2
La ciudad de San Francisco está en el gancho por casi $3 millones para comprar un nuevo estacionamiento en la esquina de San Francisco y las avenidas del Pacífico,es,2
C'è un nuovo documentario in uscita con la storia di una coppia che è andata in una scuola che avrebbe dovuto essere un rifugio per gli abusati,it,2
On a constaté que l'augmentation des coûts de l'éducation et des faibles revenus était liée à des taux d'obésité plus élevés et que l'obésité était un facteur de risque majeur.,fr,0
"""Penso che siamo in un bel posto,"" ha detto il signor Trump, che era seduto sul suo consiglio di amministrazione quando è diventato presidente",it,2
"Il sito ufficiale della United States Air Force (USAF) a Chicago, Illinois non accetta più dollari dei contribuenti statunitensi.",it,0
"V.1.2 - Mai 29, 2016. Fehler behoben, bei dem die folgenden Werte nicht korrekt angezeigt werden. - Fehler behoben",de,0
"Greens MP John Faulkner has said he would not support a move to scrap the tax credit.

Earlier this week, the Greens",en,0
"La transacción inmobiliaria más costosa en la historia de EE.UU. se ha vendido en Washington D.C., debido a la Corte Suprema",es,0
"Sitting at the front of the line for the team in the Eastern Conference finals, the Nuggets are the kind of team that can win a championship",en,2
"Dans le sillage de la mort d'un jeune homme tué dans un accident de voiture tôt mercredi matin, plus de 40 personnes ont assisté à une veillée",fr,2
El hombre que irrumpió en el Comité Judicial del Senado el jueves es un ex agente del FBI que ayudó a organizar los ataques del 11 de septiembre de 2001,es,2
"Ein paar Monate später, nach einer Flut von Medienberichterstattung, erhielt ich einen Anruf von einer Freundin. Sie war eine junge Frau, die gestorben war an",de,0
"Forced to play with their favorite toys, the kids have chosen to play with their favorite toys.

As the kids are enjoying their favorite",en,2
"Bryan Fuller, The Walking Dead's most anticipated television series, is now back with his new show, The Walking Dead: Season 3.
",en,2
"
The New York Times reports that ""a senior administration official said the administration wants to avoid a 'political gridlock' in Egypt's government and",en,0
"""Non abbiamo intenzione di rimuovere il programma dal campus,"" ha detto il consigliere studentesco Edie C. Evans, che rappresenta il quartiere. """,it,0
"The following is an excerpt from the recent article by Brian McEwen in the New York Times titled ""The Best of America: The Great American",en,2
"""Hay mucha gente que lo hace por el dinero, y esa es la belleza de ello"", dijo Bob Dittman, un",es,2
"Il giorno dopo, quando la squadra ebbe finalmente una riunione, furono accolti da una grande folla. Il gruppo arrivò al luogo dell'incontro, dove",it,1
"È un fatto che il nostro mondo non è più un luogo dove possiamo dire: ""No, non troveremo un lavoro",it,0
"I'm not sure if they're talking about the ""Frozen"" films or the ""Saving Private Ryan."" The only thing I can think",en,1
"Mack è stato nello show solo per una stagione, ma è ancora un attore formidabile nonostante la sua età. E 'sempre stato un enorme",it,2
"Una settimana fa, il Senato ha approvato un disegno di legge che avrebbe permesso al Servizio Postale degli Stati Uniti di negare l'imbarco per chiunque non sia un cittadino",it,0
"De la même manière que le bouton ""non"" est utilisé dans l'iPhone 5 d'Apple, le bouton ""non"" est utilisé dans l'iPhone",fr,1
"Pittsburgh (AP) — Un policier de Pittsburgh a tué un homme qui a essayé de l'aider à s'échapper de la police, a déclaré la police.",fr,0
"NHL.com's Brian Burke has asked the NHL's Washington Capitals to make a trade for Alex Ovechkin.

Ove",en,0
- Geschrieben vom Autor,de,2
"(CNN) Estados Unidos es un gran lugar para estar, pero también es un lugar de tremendo riesgo.",es,2
"La première fois que j'ai vu le livre, j'ai immédiatement été intrigué par le détail. Le livre décrit la vie d'un homme qui a dû voyager",fr,2
"[3]

The Great Depression

With the Federal Reserve's current rate of interest at historic lows, the stock market in the United",en,1
"A. Introducción El concepto del ""limo rosado"" (también conocido como el ""limo blanco"" o el ""limo púrpura""",es,1
"In order to make the game better, we are going to add some features to the UI.

With the addition of the new animations,",en,2
"MADISON, Wis. -- Das Madison Police Department untersucht einen Überfall von Raubüberfällen in der Stadt, einschließlich eines in der Nähe der University of Wisconsin.",de,2
"
LONDON (Reuters) - Britain's leading U.S. bank said on Wednesday its assets would not be compromised as a result of a",en,0
"Soixante-quatre pour cent des Américains disent qu'ils sont « très satisfaits » de la façon dont le gouvernement fédéral gère l'économie, selon une",fr,2
"La Casa Bianca e il Congresso sono stati in trattative per cercare di approvare un disegno di legge per abrogare e sostituire ObamaCare, ma la Casa Bianca sta cercando di fare",it,1
"Das National Crime Information Center des FBI, eine Abteilung des Justizministeriums, hilft dem FBI, Informationen über das schwerste Verbrechen zu sammeln, das",de,2
"""Ich habe dies seit über 20 Jahren getan und ich weiß, es wird ein harter Kampf sein. Es ist in den letzten 12 Jahren getan worden.",de,2
"
Cancer and Reproductive Harm- Cancer and Reproductive Harm- www.P65Warnings.ca.gov

Included",en,0
Le Comité de renseignement de la Chambre a publié jeudi ses conclusions selon lesquelles la Russie s'était immiscée dans l'élection présidentielle de l'année dernière.,fr,0
"El New York Times informó recientemente que el presidente de campaña de Donald Trump, Paul Manafort, está tratando de construir una nueva campaña en Ucrania.",es,0
"
A member of the Chicago Police Department has been charged in the shooting of a black teenager by police in an area of the city where the shooting",en,1
Sugar is a sweet flavor that you are very sensitive to. The sugar in sugar is a naturally occurring natural chemical that is found in all fruit,en,2
"Prière et guérison: Sanskrit: ""Rama"" est le mot pour ""prière"". Il est utilisé",fr,2
(Photo: Mike Konczal/Getty Images) Le monde a toujours eu de bonnes relations avec la Chine.,fr,2
Sto facendo un sacco di lettura. Ho letto un sacco di libri. Sto facendo un sacco di lettura. Ho letto un sacco,it,0
Los siguientes son algunos de los temas que me gustaría discutir con usted.,es,2
2.10.0 Esta actualización corrige un problema que causó que el juego se estrellara mientras jugaba un juego en línea. 2.9.3,es,0
"S.C. Nr. 8.06(a)(1)(A) Jede Person, die gegen eine Bestimmung dieses Kapitels verstößt, verpflichtet sich",de,0
Todos sabemos lo frustrante que es cuando la gente se queja de cómo Internet se ha vuelto demasiado grande para nosotros.,es,0
L'UESPWiki – Votre source pour The Elder Scrolls depuis 1995 Cet article porte sur le personnage.,fr,2
"Wir versuchen, eine Lösung für das Problem des Missbrauchs von Kindern durch ihre Eltern zu finden.",de,2
"En el episodio de esta semana de The Caper, echamos un vistazo a algunas de sus películas favoritas y programas de televisión.",es,2
"The US government has admitted it has been ""overwhelmed"" by the findings of a US-led investigation into the use of child pornography in",en,0
"2.3.3 Fehler behoben, der dazu führen könnte, dass der Bildschirm beim Start einfriert und das Spiel abstürzt 2.2",de,0
"Eli, el hombre que fue asesinado a tiros, fue una de las muchas personas del día que asistieron a su funeral.",es,2
"""No voy a entrar en eso"", dijo, ""a menos que sea como, ""Sí, eso es un montón de cosas que",es,0
"La primera vez que vi ""Mi nombre es Earl"" de nuevo, me quedé impresionado. No podía creer que todavía estuviera en una de mis",es,2
"Damas y caballeros, estoy aquí para hablarles sobre el mayor minorista en línea del mundo.",es,2
Un nuovo rapporto pubblicato dal Congressional Budget Office (CBO) mostra che la spesa federale per l'assistenza sanitaria per i poveri è cresciuta da un $ sbalorditivo,it,0
La seule chose qui m'excite à avoir une nouvelle maison est le fait que le salon de ma famille va être un peu plus grand.,fr,2
"Dennis Smith, a former NFL star turned NFL star and two-time Pro Bowl receiver, was sentenced to three years in prison on Thursday.",en,0
"In der Nachkriegswelt der Medien, wenn die Welt etwas weniger frei wäre, was wäre dann die Welt der Inhalte",de,1
"COPYRIGHT 2015 ISTITUTO INTERNAZIONALE per i diritti di proprietà intellettuale, Institut Universitaire de Barcelona, Spagna.",it,0
"Saludos a todos, Hemos estado trabajando duro en el juego y va a añadir más características a lo largo del ciclo, así que mantenerse en sintonía para",es,2
"We'll be on the road at the end of October to help you and your family enjoy a little family time.

Our event schedule
",en,2
"""There is no reason why the American military can engage in any sort of training program that is not authorized by the United Nations Security Council,"" Obama",en,0
1.1.2.1.2.30.1.1.1.9.0.2,de,0
"« C'est une bonne amie, a déclaré M. Zuckerman, le législateur démocratique. Elle est prête à être interviewée. »",fr,2
Voici une liste de tous les jeux connus en Fallout 4. Voici une liste de tous les jeux connus en Fallout,fr,2
"""It's very hard to be an American. It's hard to be a member of a group. And it's very hard to be able",en,0
"Dies ist die zweite in einer Reihe von Beiträgen, wie man eine Web-basierte Web-App auf Ihrem Windows Phone 7 oder Windows Phone 8 laufen.",de,2
"The United States is ""not going to make any big deal about it,"" he said, even as he tried to show he was not trying to",en,0
"Un uomo che è stato giudicato colpevole di aver picchiato un senzatetto in California è stato condannato a 19 mesi di carcere, e sarà eleggibile per la libertà condizionale il prossimo",it,0
"Quanto ti importa di un bambino che è un ""branco di bambini?"" La risposta è ""almeno 300.000 dollari.""",it,0
"Le nouveau MacBook Air est une nouvelle pièce de matériel pour Apple. Le nouveau MacBook Air est livré avec le nouveau port Thunderbolt 3, et",fr,2
"Un ex marine americano e l'autore di ""La morte della guerra sulle donne,"" dice che non è mai stata aggredita sessualmente,",it,2
"I know this is a bit of a long post, but I'm starting to get really excited about the new version of the game. I wanted",en,1
"Dans cette vidéo, vous apprendrez les leçons les plus importantes que vous pouvez apprendre du jeu. Le jeu est conçu pour un joueur spécifique",fr,2
"
""The first thing you think of when you meet an old friend is 'What does this mean?' You don't realize how much you share",en,0
"
A man was shot and killed by a Dallas police officer at a home in the 900 block of South Main Street late Thursday night, according to",en,0
"Desde el exterior, la historia del hombre detrás del mayor ciberataque del mundo parece extraña, pero no lo es.",es,0
"Vous pouvez obtenir un rabais de 10% sur votre première commande, ou payer le coût d'expédition complet.",fr,0
Il seguente è un elenco di tutti gli articoli di questa serie. Ci sono molti articoli di questa serie che sono stati fatti da persone.,it,2
"HUNTSVILLE, Ala. - Le directeur sportif de l'État de l'Alabama Jim Chaney a été en contact avec la NCAA pour essayer de l'aider à obtenir",fr,2
"Par Sridhar Nandan Ces derniers mois, l'Inde, en tant que pays en développement, est entrée dans une nouvelle phase de développement économique.",fr,2
"La presse canadienne OTTAWA -- Si les conservateurs doivent gagner les prochaines élections, ils devront récupérer suffisamment de sièges pour",fr,1
No sé qué pasó después cuando era niño y probablemente no valga la pena el esfuerzo. No voy a decir que mis padres eran todos,es,0
"Le prime quattro voci di The Witcher 3 avevano molte ragioni per essere entusiasti del gioco, ma la maggior parte di loro si sentiva come le parti più importanti di",it,1
"It seems like a good time to take a look at some of the top defensive players of the past three years.

Here are some of",en,2
"
A day of reckoning has been left to mark the day of the reckoning.

It's been nine days since the first American Muslim woman",en,2
Das National Geographic Center for Geology and Geophysics des American Museum of Natural History ist das weltweit größte Museum für Naturgeschichte.,de,2
"Cuando estaba creciendo, lo primero que hice cuando estábamos en la escuela media fue tomar una foto de una joven y ponerla.",es,2
"Die ""größte"" Finanzkrise in der US-Geschichte war die Große Rezession. Von den 6,2 Billionen Dollar",de,0
2-5) 1 1 1 2 2 2 2 5 6,de,2
"Erik D. Gribben, Ph.D., un investigatore senior presso l'Istituto Nazionale di Salute Mentale, e James D. Tipp",it,2
La Unión Americana de Libertades Civiles (ACLU) presentó una demanda el martes para impedir que la administración Obama utilizara su poder para obligar a los funcionarios federales a,es,0
"Wie man eine ""echte"" Facebook-Seite erstellt und wie man eine ""echte"" Facebook-Seite erstellt Facebook ist eine soziale Plattform, die",de,2
Ein Update über den Status der ersten Phase der Sprengung am südlichen Ende der Stadt Koryohe.,de,2
"Les yeux de Vincent étaient fermés et ses lèvres étaient légèrement séparées, mais l'expression sur le visage de Vincent restait complètement inchangée.",fr,0
Le dernier épisode d'Arrow est un spectacle incroyable. C'est un spectacle qui nous montre le monde à travers un,fr,2
"La Federal Reserve, la Federal Reserve, e il resto del settore finanziario, sono stati all-in sul ""troppo grande per fallire""",it,0
"
The first of six U.S. military exercises planned for the Southern Pacific region of the Pacific on Aug. 31-32 will be conducted",en,2
"Das weltweit größte und teuerste Solarprojekt, Arup, wird laut",de,2
"""Me gustaría dar las gracias a la comunidad por su paciencia. Me gustaría dar las gracias a todos los que nos han apoyado"", continuó.",es,2
"(CNN) -- The head of the Obama administration's National Counterterrorism Center accused Attorney General Eric Holder of ""crap"" after he said Obama",en,0
"TAMPA, Fla. -- Tampa Bay Buccaneers running back Mike Glennon will be eligible to return to practice Friday, the team announced.
",en,0
"Circa un americano su sette dice di aver visto una persona morire per una pistola, e un quarto dice cose come la morte per suicidio.",it,0
Es gab ein großes Interesse an der Debatte über die Zukunft des NHS zwischen den Konservativen und Labour im Anschluss an die Parteikonferenz,de,2
"Le gouvernement des États-Unis a dépensé plus d'un milliard de dollars sous son contrôle depuis 2007 pour lutter contre la toxicomanie, les organisations de lutte contre la toxicomanie et d'autres",fr,0
"
The federal government has banned the sale of heroin in the United States.

In a statement, the Drug Enforcement Administration said that no additional",en,0
"Ho un sacco di domande su questa domanda. Non riesco a capire come la risposta è ""sì, ma è quello che facciamo.""",it,0
"""C'est une année difficile pour nous. Nous sommes toujours au début de l'année, mais nous faisons certainement des choses que nous voulons",fr,1
"For the first time in his life, he was diagnosed with leukemia.

He was diagnosed with breast cancer last year.

""I",en,0
Sono cosi' emozionata di far parte di questa comunita'... che e' fonte di ispirazione sentire il lavoro di migliaia di persone nella mia comunita'.,it,2
"MOSCOW (Reuters) - La Russie lèvera son interdiction sur la vente de chasseurs russes à l'Ukraine dès cette semaine, le",fr,0
"Hip hop è un genere che è ampiamente abbracciato da hipsters. Un certo numero di artisti hop hanno pubblicato singoli con musica del genere, molti",it,1
"JACKSON, Miss. -- L'équipe de football de l'Université du Mississippi a été condamnée à une amende de 1 000 $ après qu'un étudiant accusé d'avoir agressé un étudiant pendant",fr,0
"Die letzten Jahre haben eine enorme Explosion in der Zahl der Menschen, die das Internet als eine Form der Kommunikation gesehen.",de,0
"Brentwood Wohnsitz und Freundin des Opfers Elizabeth DeCoutere, 23, wurde in den Kopf mit einem AR-15 in der",de,2
"Cleveland Browns Quarterback Johnny Manziel (13) wirft einen Pass während der zweiten Hälfte eines NFL-Fußballspiels im American Legion Stadium in Cleveland,",de,0
"Ein Mann schoss auf einen Bus in Northampton, England, und verwundete einen anderen, bevor er verhaftet wurde, sagte die Polizei.",de,0
"- El cuerpo de un hombre encontrado en un río cerca de la línea del estado de Carolina del Sur fue encontrado en una alcantarilla cerca de su casa el miércoles por la tarde, estado",es,1
"(Bild: Getty Images) Der Oberste Gerichtshof hat sich bereit erklärt, Argumente beim Prozess gegen einen ehemaligen Polizisten zu hören, der sagte, er sei getötet worden.",de,2
"Negli ultimi mesi il numero delle persone affette da HIV/AIDS è aumentato, a causa della crescente accettazione dell'AIDS come problema di salute pubblica.",it,1
"Das FBI hat eine Erklärung veröffentlicht, die besagt, dass es glaubt, dass die ""unbezogenen"" Aussagen als Antwort auf eine Reihe von Telefonanrufen an",de,0
"Le nombre de personnes arrêtées pour des infractions liées à la drogue depuis 2010 a augmenté de près de 200 %, selon l ' Office national des statistiques.",fr,0
"« Beaucoup de gens qui luttent, qui luttent et qui luttent pour survivre, ne savent pas comment en sortir », a déclaré Robert Moore.",fr,1
"Cameron Diaz, cierto, y su esposa, Karen, en una corte en Los Ángeles. (Foto: Lacey S. Hill para el",es,2
Estoy escribiendo una serie de artículos que mostrarán cómo utilizar una impresora 3D para crear un modelo impreso 3D de una criatura que se ve,es,1
"Para mostrar nuestro agradecimiento, ofrecemos un cupón de descuento del 5% para este producto. Un agradecimiento especial a nuestros patrocinadores y clientes leales y generosos,",es,2
Un homme a été arrêté après que lui et un groupe d'amis aient lancé une bombe à essence sur la police alors qu'ils essayaient d'arrêter un homme qu'ils pensaient être,fr,0
He estado usando un montón de tableros Arduino últimamente y estoy muy emocionado por el nuevo tablero que he estado usando.,es,2
"Ho un budget molto limitato. Se avete bisogno di una parte, si prega di prendere in considerazione il supporto su Patreon. Ho bisogno del vostro aiuto per mantenere il",it,0
J'en ai parlé à beaucoup de gens. J'ai été vraiment impressionné par la façon dont l'application fonctionne. Je ne sais pas si,fr,2
"Oubliez l'expression ""pâturante"" que beaucoup de gens essaient de dire sur les aliments ""pâturants"". Les États-Unis est",fr,0
El cuadro siguiente muestra el número medio de solicitudes de una página web (en miles) para el período examinado.,es,1
"""¿Por qué crees que mi madre está tan jodidamente obsesionada con estas armas?"" Ella está tan obsesionada con ellas que voy a",es,2
Nous sommes heureux d'annoncer la sortie d'un nouveau jeu: Star Wars: Jedi Knight. Ce nouveau jeu est basé sur le Star Wars original,fr,2
"
The ""most controversial"" of the week was the decision by the US Department of Justice to end the Obama administration's controversial surveillance program, which",en,0
La ville est maintenant en état d'urgence après qu'un incendie ait éclaté dans une maison dans le quartier 900 de West West St. mardi soir,fr,0
"John F. Kennedy Jr., Robert F. Kennedy und der erste amerikanische Präsident Thomas Jefferson:",de,2
"""The United States will have to take a look at it,"" Clinton said on CBS's ""Face the Nation."" ""It's really hard to",en,0
(CNN) -- Un homme qui aurait étouffé sa mère et utilisé un téléphone portable pour la menacer devant les parents d'un enfant de 6 ans.,fr,0
El estado de Minnesota ha aprobado un proyecto de ley que prohibiría el uso de dispensarios de marihuana con fines recreativos.,es,0
"Se e' questo il caso, puoi unirti a me nel gruppo Facebook dove pubblichero' i miei pensieri sulle notizie della settimana.",it,1
"Le seguenti sono alcune delle mie foto preferite dalla mia vita. Sono stato quello che li ha pubblicati. Mia madre, che ha 65 anni",it,2
"Desde el primer episodio de la nueva temporada: ""The Dark Knight Rises"" se estrena en AMC el domingo 21 de noviembre.",es,2
4 La città di New York City ha una posizione di manager di emergenza in tutta la città disponibile. 5 C'è una sovvenzione di $ 2.000.000,it,2
"Hace un par de semanas estaba mirando cuánto se puede obtener de alquilar un auto, aunque no es un asunto fácil para",es,1
"[Anmerkung des Herausgebers: Im vorherigen Beitrag haben wir dieses Thema ausführlich diskutiert, und in diesem Beitrag werden wir die technischen Aspekte der",de,2
"En una rara primera vez para BuzzFeed News, la organización de noticias ha estado informando sobre una serie de cosas sobre el tema de la agresión sexual en el lugar de trabajo",es,1
"En mi primer post en mi blog, hablé sobre lo que he aprendido de mi experiencia con ser profesor de inglés en el Reino Unido, y cómo",es,2
¿Qué piensas de la nueva temporada de 'Veep'? ¿Crees que va a ser una buena temporada?,es,1
"Syracuse, N.Y. (AP) — Syracuse University prévoit de tester un prototype qui pourrait être utilisé pour suivre le mouvement",fr,2
Nous utiliserons notre site Web pour vous fournir les dernières nouvelles et informations sur notre entreprise et notre fonctionnement. Le site Web est maintenant fermé.,fr,2
You can also use the search below to find your closest location.,en,2
"La Agencia de Seguridad Nacional de los EE.UU. ha estado en vigilancia durante varios años, pero las actividades de la agencia se han limitado a los nacionales",es,1
"L'amministrazione Obama ha ordinato una revisione del ruolo dei militari in Siria, una mossa che le permetterebbe di tenere conto della recente situazione del paese.",it,2
"Si necesita más información sobre el esfuerzo del gobierno federal para regular el consumo de marihuana, lea nuestra historia completa sobre el estado de la marihuana en el New",es,1
"
The most frequent complaint in the world about climate change is the lack of action. It's why we've been in the climate change debate for",en,0
C.O.U.L.E.L.A. RUN 1.1.1.7.4,it,0
Un ancien officier américain qui a plaidé coupable d'avoir conspiré pour voler une voiture alors qu'il servait en Irak a déclaré qu'il avait reçu un avertissement au sujet du,fr,0
"Im Anschluss an die Boston-Marathon-Bombardierungen am 7. November, eine kleine Gruppe von ehemaligen Massachusetts Gov. Mitt Romney Anhänger reichte eine Bundesklage dieses",de,0
"Ein Mann, der beschuldigt wurde, eine Frau in seinem Haus in der Nähe der Stadt Toulouse zu vergewaltigen, wurde von der Polizei im östlichen Vorort von Nizza verhaftet.",de,2
"""Wir sind jetzt in einer Position, wo wir vorankommen können und wir werden nicht darauf warten, dass die nächste Regierung das tut.",de,2
"Atomwaffen sind eine sehr große Sache, und die Welt wartet immer noch auf einen Bericht darüber, wie sie eingesetzt werden.",de,2
"Enfant, il a été intimidé par son meilleur ami, un homme qui semblait connaître peu le monde, et la rigueur de son père.",fr,2
"C'est à ce moment de l'année encore quand les vacances viennent et vont. Que vous alliez pour un bash des vacances, faire du shopping pour de nouvelles chaussures",fr,2
"Saludos a todos! Ahora que he tenido tiempo de escribir este post, he decidido seguir adelante y hablar de la gran",es,2
La nueva generación del complejo militar-industrial de los Estados Unidos es mucho más grande que el presupuesto militar.,es,2
"Le nombre de personnes ayant reçu un diagnostic de VIH/sida a considérablement augmenté au cours de la dernière décennie, selon une nouvelle étude publiée dans la revue AIDS",fr,0
"Questo articolo proviene dall'archivio del nostro partner. Per il secondo anno consecutivo, il New York Times ha confermato il proprio top-selling",it,2
"Tuve una muy mala experiencia con el Oculus Rift y quería compartir contigo cómo lo hice, pero no pude conseguir",es,0
"Eine Frau aus New Jersey, die letztes Jahr wegen eines tödlichen Unfalls in einem New Jersey Park verhaftet wurde, wurde am",de,2
"Cleveland Cavaliers estará buscando añadir otro veterano en el futuro. LeBron James podría ser el tipo, pero James no va a hacer",es,1
"""Wir sind stolz darauf, als einer der ersten die S.T.A.R. Labs in Austin, Texas, ins Leben gerufen zu haben"", sagte",de,2
"""Je préférerais que ce soit un vrai combat qu'un combat entre un homme et une femme,"" dit-elle. ""Ce qu'il est",fr,1
"Spencer Platt/Getty Images Así que fue con gran tristeza que escribí la siguiente declaración: ""Esto no es",es,0
"
MADISON, Wis. (AP) — Wisconsin Gov. Scott Walker's plan to eliminate a key tax breaks for business and individuals,",en,2
"MÉDIAS SOCIAUX The Washington Post, The Atlantic, The New York Times, The Wall Street Journal, The New York Times,",fr,1
Il ne fait aucun doute que les New York Jets sont l'une des offenses les plus talentueuses de la ligue.,fr,2
"Foto En el caso del líder norcoreano Kim Jong Un, las consecuencias de sus acciones no son tan graves como podrían.",es,1
"Gegen Ende der zweiten Hälfte der letzten Saison, war das Team ohne den Ball für einen Großteil des Spiels. Das führte zu der ersten",de,0
