tweet,language,labels
"Per la seconda volta in un mese, l'Università del Maryland ha annunciato che sta prendendo il comando nella costruzione di un nuovo centro scientifico e tecnologico a Baltimora.",it,2
A new study by the University of Maryland's Center for Environmental Health and Medical Research (CEMHRM) and the University of Illinois at Ur,en,2
Les États-Unis sont l'un des nombreux pays dans le monde où le nombre de personnes qui utilisent la contraception a considérablement diminué par rapport au niveau le plus élevé de la planète.,fr,0
"Die Vereinigten Staaten führen seit vielen Jahren einen Krieg mit al-Qaida im Jemen, aber niemand weiß mit Sicherheit, wie viele sie getötet haben.",de,1
"(CNN) Il Dipartimento degli Stati Uniti di Sicurezza Nazionale ha detto Venerdì ha chiesto al fisco di smettere di rintracciare milioni di redditi stranieri, ma",it,0
What's New: - Update 2.0.0 - Se ha lanzado una nueva versión del juego. - Actualizado,es,0
Le président lituanien Viljoen Kudrin a déclaré que l'UE devrait aider la Lituanie à se défendre contre l'agression russe.,fr,1
"""Non si tratta di soldi, si tratta della mia comunità,"" ha detto. ""Si tratta di essere parte di questa comunità.""",it,2
"In this report, we review the data and the evidence available on the relationship between smoking and cancer risk. We show that smoking among young adults is",en,2
Il primo da testare è quello che combina sia il chip G-SYNC con una scheda VGA full-size.,it,2
"Vor etwas mehr als einem Jahr veröffentlichten Forscher in Großbritannien ein Papier, in dem sie behaupteten, dass ein entzündungshemmendes Medikament helfen könnte, Osteoporose zu verhindern,",de,0
La Fuerza Aérea de EE.UU. ha estado recopilando nuevos datos sobre cuántos pilotos estadounidenses han estado involucrados en misiones de combate sobre el,es,2
"En 2015, la Cour suprême des États-Unis a statué que le gouvernement a le droit de ""liberté d'expression"" dans les espaces publics.",fr,0
"Es ist jetzt etwas anders als im Jahr 2004. Während die USA keine einzige Militärbasis hatten, war es eine riesige.",de,1
"La coalición liderada por Estados Unidos ha enviado casi 4.000 tropas y equipo más a Afganistán, dijo el ejército.",es,0
"The US government has said the US will do more to help Israel than any other country in the region.

The announcement came after Mr Netanyahu",en,0
"Un professeur de journalisme de l'Université d'État de l'Arizona a déclaré au Huffington Post que ses recherches sur l'état de la nouvelle ont révélé que la nouvelle est ""pas",fr,0
Kanye West est l'un des nombreux artistes qui ont fait leur chemin dans le monde du rap sans faire un seul son.,fr,2
Die neue Studie des Center for Health and Health Economics der University of California-Berkeley basiert auf Daten der National Health Interview Survey,de,2
He sido un fan de la serie Dark Tower desde su lanzamiento en 1989. Soy un gran fan de la Torre Oscura original (y,es,2
"Presupuestos y Reglas Hay un montón de maneras de hacer un buen dinero jugando al póquer en línea. Pero, ¿cuáles son exactamente las reglas?",es,1
"Cuando estamos hablando del futuro de su negocio y su negocio se basa en una filosofía sobre la diversidad, y lo que usted puede hacer para hacer que",es,2
"I National Institutes of Health (NIH) hanno assegnato 6,5 milioni di dollari a un gruppo di fondazioni private per contribuire a finanziare la ricerca su",it,1
Los San Francisco 49ers y los Seattle Seahawks han acordado un acuerdo para seguir jugando juntos antes de la temporada 2015.,es,2
"La réforme de la justice pénale est une initiative bipartite aux États-Unis, donc il n'est pas surprenant qu'il semble que les fédéraux prennent une",fr,1
/u/The_Scarlet_Fighter_3rd The Scarlet Fighter 3rd is a 2.5+ map release,it,2
"Esta es la primera y única revisión del nuevo álbum de J-Lo. Sigue al álbum debut del álbum, ""The Last""",es,2
"Il presidente degli Stati Uniti Barack Obama tiene una copia di una lettera, datata 12 dicembre 2012, dal Segretario del Tesoro degli Stati Uniti",it,0
"Die Bundesregierung nutzt das E-Mail-Alarmsystem, um die Menschen über die bevorstehende Arbeit für eine unbestimmte Anzahl von Tagen oder Wochen zu informieren.",de,2
"« C'est le sujet le plus controversé du monde, et pas seulement parce que c'est un sujet aussi controversé.",fr,0
"Después de la elección de Donald Trump como el 45o Presidente de los Estados Unidos, algunos de los mismos activistas que perdieron en la campaña",es,0
"""I'm not very good at math,"" he said. ""I'm a very good player.""

But he was clearly not looking at",en,0
Bobby Jones n'a jamais été un grand joueur dans la NBA. Il était un joueur de basket-ball terrible. Il était un joueur terrible dans son troisième ou quatrième,fr,0
"- Advertisement -

The ""Camelot"" story has become the world's most popular and popular novel, and is now being retold",en,2
Cincinnati Bengals fine difensiva Mike Wallace (10) scende in campo su un tentativo di field goal contro i Detroit Lions a Soldier Field il febbraio.,it,1
"- Advertisement -

On Dec. 15, 2011, I began my mission to explore the mysteries of the universe. I arrived on my destination",en,2
"Ein ehemaliger FBI-Agent, der in den 1980er Jahren als Computer-Sicherheitschef des Büros diente, John R. McElroy, wurde identifiziert.",de,2
NEXT: Les faits saillants du jeu All-Star Les Celtics ont gagné quatre matchs consécutifs depuis qu'ils ont signé Carmelo Anthony à un cinq-,fr,2
"Gente qui al MHS, sono già stata qui: sono qui dal 1985. Ero nel bel mezzo di un",it,2
"Vorbei waren die Tage des Internets, in denen jeder Zugang zu den gleichen Inhalten und Diensten haben konnte, wie damals, als man es konnte.",de,2
"No soy una persona de ningún tipo en cuanto al origen de mis palabras, quién soy o por qué estoy aquí.",es,0
Des poursuites pénales sont engagées contre un cadre supérieur du Service postal des États-Unis pour avoir exploité une entreprise de vente par correspondance aux États-Unis.,fr,0
"Sono sempre stato un fan di D&D, e volevo condividere la storia delle mie prime esperienze con il gioco. Ho scritto",it,2
Il Dipartimento dell'Energia degli Stati Uniti ha annunciato di aver concluso un importante progetto che trasformerà l'approvvigionamento energetico rinnovabile della nazione.,it,2
"Vancouver es una ciudad con una historia vibrante y una cultura rica. También es el hogar de una escena gastronómica próspera, una abundancia de",es,2
A new study finds that there's less than a third of the risk associated with marijuana use among teens who smoke marijuana but don't consume it daily,en,0
"- This is a complete rewrite of an old game. It is a continuation of an old game. This version includes new features, new gameplay,",en,2
"El gobierno de Estados Unidos pronto podría estar adoptando un enfoque más duro del programa nuclear de Irán que nunca antes, y eso podría significar algo más duro",es,1
"[Updated at 3:53 p.m. ET]

President Donald Trump's latest public comments on immigration are causing a stir among Republicans",en,0
"""Ce n'est pas à propos de l'argent,"" dit-elle. ""C'est à propos de qui arrive à gérer."" McCarthy dit le déménagement",fr,0
"No sé si es una coincidencia o no, pero sí sé que mi ""ateo apasionado"" es un hombre.",es,1
"Nomads:

Mummy:

Tyrant:

Lucky Rabbit:

Fairy Tale:

",en,1
"El FBI confirmó que un agente del FBI que trabaja en la oficina del FBI en Denver ha sido suspendido indefinidamente por ""extremista y otros actos criminales"".",es,0
"Ho fatto molti di questi, e tutti hanno la stessa cosa: penso che sia una grande idea. Non l'ho mai detto a nessuno",it,0
"Dies ist ein sehr cooles Kunstwerk, das Sie vielleicht in Form eines Fotos gesehen haben, aber es ist nicht für alle.",de,2
Diese Seite ist Teil von © FOTW Flags Of The World website Hollywood Country Republic of South Africa Last,de,2
"Compañeros escritores y periodistas, tenga en cuenta que las opiniones expresadas son las del autor y no reflejan necesariamente las opiniones de The Wall Street Journal",es,0
"Brick & Mortar es una empresa altamente calificada, galardonada y multimillonaria. Creemos en la innovación de nuevos tipos de",es,2
"« C'est une situation extrêmement dangereuse pour un enfant qui est blessé ou tué par une arme à feu », a déclaré le juge.",fr,0
"«Es una pena que el Gobierno del Reino Unido no haya considerado esta cuestión en el contexto actual, y el Gobierno debe cesar inmediatamente su financiación para",es,0
"Fondée en 2004 par un groupe d'ex-conservateurs qui s'inquiètent depuis longtemps de la propagation de la pédopornographie, l'organisation s'est développée pour inclure",fr,2
P.S. Le P.S. arrive bientôt... j'espère vous voir tous dans la semaine prochaine...,fr,2
"""Wir waren schockiert, von diesem Verbrechen zu erfahren"", sagte der FBI-Bekämpfung Terrorismus Center David Baugh, der als Berater",de,0
Une nouvelle classe de micro-organismes appelés bactéries a été découverte à la surface de la surface du soleil.,fr,2
"Dans la première partie de cette série, je vais jeter un oeil à certaines des nouvelles Bitcoin plus récentes qui est rapporté.",fr,1
El número de reclusos en el sistema penitenciario ha aumentado de 1.200 en 2007 a más de 2.500 en 2014.,es,0
Tottenham Hotspur (Inglaterra) Los actuales campeones de la FA Cup ahora han ganado 19 puntos de sus últimos 11 partidos.,es,2
"Praise be to Allaah.

Praise be to Allaah.

Praise be to Allaah.

Praise be to Allaah",en,0
"Un homme a été mortellement abattu par un adjoint du shérif après avoir tenté de courir et de sauter dans une voiture dans une rue occupée, ont dit les officiels.",fr,0
"Pour tous ceux qui veulent apprendre le ""Prairie Style"" ou ""The World's Greatest Restaurant"" pour la première fois, je vais",fr,2
La cosa più importante da fare quando si sta cercando di fare un profitto è quello di fare un profitto. Questo è esattamente ciò che accade quando si,it,2
"""We don't want to be a country that's fighting for a war in the Middle East,"" he said. ""We want to be a",en,0
"In this week's episode, we look at the changes that have led to our current health care system. We bring you some of the highlights from",en,2
"- Werbung - Ein neuer Bericht vom Center for American Progress, einem liberalen Think Tank, zeigt, dass als Ergebnis der erschwinglichen",de,0
"(CNN) While the White House and congressional leaders continue to discuss whether President Donald Trump will fire FBI Director James Comey, others in the political world",en,1
"Was ist eine ""predictive Vorhersage""? Eine predictive Vorhersage ist eine Vorhersage, die auf einer Vorhersage basiert, die auf einer spezifischen Wahrscheinlichkeitsverteilung basiert.",de,0
"
One of the most popular and influential media outlets in the world, The Washington Post has published articles, articles, and interviews that focus on a",en,2
Esta es una transcripción apresurada. Puede que la copia no esté en su forma final. AMY GOODMAN: Pasamos ahora a la primera de dos entrevistas,es,0
"""I think it's important for this country to be able to say how we're going to make it better.""

The two senators said",en,2
"
The U.S. Marine Corps has lost track of its missing sailors and their loved ones in recent weeks as the investigation into the disappearance of",en,2
"This is a rush transcript. Copy may not be in its final form.

AMY GOODMAN: We turn now to the latest presidential campaign of",en,0
Der Oberste Gerichtshof hörte mündliche Argumente Dienstag auf einer Beschwerde von Milwaukee County. Der Fall ist jetzt vor dem US-Berufungsgericht für,de,0
La Maison-Blanche a déclaré jeudi que l'administration revoit une décision sur un ordre exécutif qui permettrait aux personnes transgenres de servir ouvertement dans l'armée.,fr,0
La New York City Transit Authority (NYT) a été dans les nouvelles récemment quand l'équipe de planification de transit de l'agence a été forcée de démissionner après un,fr,0
"Conformemente alle disposizioni della sezione 4 (b) (3) (B), una persona condannata per un reato ai fini della",it,2
Tengo una bonita botella de mi bourbon favorito. Lo encontré en el correo hace una semana y fue una agradable sorpresa.,es,2
"Non so tu, ma io ho un grosso problema, non e' una bella sensazione, ma non e' una brutta sensazione.",it,1
"Nel maggio 2009, ho scritto di una storia che riguardava l'uso del ""linguaggio strettamente legale"" per descrivere alcuni aspetti della legge in",it,0
(Questo articolo è stato aggiornato per includere le seguenti informazioni: Il seguente è un elenco di eventi in Star Wars Rebels: The Clone,it,1
"The White House has been a slow-moving and sometimes messy transition for Trump. The media has made it harder for him to stay on message,",en,1
"""Ich kann mir nicht vorstellen, was hätte passieren können, wenn sie gerade versucht hätten, das Gegenteil zu tun.",de,0
: Die Geschichte des Aufstiegs und Fallens der katholischen Kirche Geschrieben von Charles C. Smith Herausgegeben von The Catholic Church in the United,de,2
"H.R. 4100 - 113th Congress (2017-2018) Modificare il titolo 18, Codice degli Stati Uniti, per disporre che il",it,0
. Questa è stata la prima volta nella storia del mondo che un indiano era stato concesso il diritto di voto in base alla loro religione o,it,0
"/u/sotero Le nom de mon nouveau projet est ""Crazy Rich"" Je vais vous donner un",fr,0
Un'indagine su una morte nelle prime ore di mercoledì mattina nella città di Nairobi è in corso. La morte di,it,2
"Ein neuer Bericht von The Economist legt nahe, dass der durchschnittliche Amerikaner in nur fünf Jahren kokainabhängig werden könnte.",de,0
"Was ist der beste Weg, um es klar zu machen, dass Sie es nicht verwenden? Hier ist eine einfache, aber leistungsfähige Weise, Ihr Verhalten zu ändern",de,2
"Il primo ad entrare in campo era un tizio di nome David. Era un vecchio, indossava una felpa con cappuccio e una camicia nera.",it,1
C'est le deuxième d'une série de messages qui sera sur l'utilisation de Node.js dans le développement Web.,fr,2
"Mit der Einführung der Apple Watch beginnt die Welt auch zu sehen, was mit Wearable-Technologie möglich ist.",de,2
"Das Beste für Sie. Dieser Artikel ist über die aktuelle Version des Spiels. Für die neueste verfügbare Version, siehe Version 4.0",de,2
"Das neue Buch des Autors, Autor der Hitserie 'Faces of Death: The Killing Ground of the Holocaust', wird veröffentlicht.",de,2
"Questa è un'anteprima delle nuove funzionalità della nuova versione di Ubuntu, che include il supporto per i repository Ubuntu Linux Mint. Per maggiori informazioni",it,2
Sie können auch die komplette Liste der 10 beliebtesten Spiele auf Steam (diese Liste wird jeden Montagmorgen aktualisiert) und überprüfen Sie unsere,de,2
"La première fois que j'ai essayé de jouer à ce jeu, je l'ai eu, et il semblait bien, donc j'ai ajouté un niveau supplémentaire pour obtenir le reste de",fr,1
"Frequently Asked Questions

What is the difference between a ""Pizza"" and a ""Pizza Express""?

Pizza Express is",en,1
CINCINNATI -- Les Bengales de Cincinnati affronteront les Steelers de Pittsburgh dimanche soir dans un rematch de Super Bowl.,fr,2
"HOT on the face Best of the year HOT on the face: the second season of ""The Walking Dead""",it,2
"""Wir sind alle auf der gleichen Ebene"", sagte einer der Organisatoren der Veranstaltung. ""Der ganze Punkt ist es, Menschen zu helfen, verstehen",de,2
"The US Supreme Court's decision this week to uphold the Affordable Care Act, the ACA's Medicaid expansion, has created a major push in Congress for",en,2
"WASHINGTON (Reuters) - La División de Seguridad Nacional del Departamento de Justicia de EE.UU. está investigando si Rusia interfirió en las elecciones presidenciales de 2016,",es,1
"Je vais supposer que vous avez déjà lu cet article, parce que c'est ce que je vais faire: vous aurez été interrogé sur le",fr,1
Le gouvernement chinois a la responsabilité particulière de promouvoir le développement économique local. Il doit veiller à ce que des conditions de concurrence équitables soient établies pour ceux qui sont,fr,2
"Das folgende ist ein Auszug aus einem Interview, das ich mit Joe Vitt am Ende der letzten Woche Episode des Podcasts hatte ""The Five Guys",de,2
"El 17 de septiembre de 2011, un juez federal emitió una orden de restricción temporal que prohibía al gobierno llevar a cabo su búsqueda de pruebas que habían sido destruidas",es,0
"Il Dipartimento dell'Agricoltura degli Stati Uniti sta prendendo un'altra linea. Si propone di regolare la produzione alimentare nel modo più restrittivo possibile, che",it,2
. . . . . . . . . .,it,0
The American Civil Liberties Union of Maryland is taking aim at a provision that would allow the government to detain people for up to two years without charge if,en,1
Nous avons décidé de faire un billet de blog séparé pour couvrir les bases du jeu. Nous allons mettre en évidence,fr,2
S. 1481 (113) war ein Gesetzentwurf im Vereinigten Staaten Kongress. Ein Gesetzentwurf muss sowohl durch das Haus und,de,0
"""Abbiamo lavorato sodo per assicurarci che fosse accessibile a tutti. Stiamo continuando a prenderci il tempo necessario per assicurarci che sia accessibile alle persone",it,2
"The federal government has announced its intention to raise the minimum wage to $15 an hour by 2016, after years of rising unemployment and rising pay scales",en,0
"
Ricardo Sousa, director of the University of California Davis Center for Investigative Journalism, was one of about 30 journalists who came to",en,2
"(Foto: Reuters) Die Obama-Regierung kündigte an, dass sie ihre Folter und andere grausame, unmenschliche oder erniedrigende Behandlung von Gefangenen beenden würde,",de,0
"Eine der beliebtesten Möglichkeiten, um Geld aus einer Wirtschaft zu bekommen ist es, aus ihm zur richtigen Zeit. Inflation ist",de,2
I know I know. I know I know. I know. I know. I know. I know. I know. I know. I,en,2
"Después de todo, es la primera vez que el gobierno ha convertido en un crimen vender",es,0
"
As they get ready to play the final three games of the season, the Rangers need to stay healthy. They have a lot of options on",en,1
"1.4.0 1.3.1 Risolto il problema con il pulsante ""Use_Fade_Tileset.""",it,1
"""Siamo profondamente offesi dal video, e abbiamo avviato un'indagine su di esso,"" ha detto in una dichiarazione. Il video, rilasciato",it,0
Gli Stati Uniti sono stati in testa dopo aver vinto i campionati mondiali con un record di 2.826.849.,it,1
"Saludos compañero Soulsman, me gustaría comenzar expresando mi sincero agradecimiento a todos ustedes que nos han estado proporcionando con",es,2
(Photo: Getty Images) La première société mondiale de sécurité automobile a offert une récompense de 18 millions de dollars pour l'information menant à l'arrestation et,fr,0
"Il governo sta progettando di investire 15 miliardi di dollari nello sviluppo di un aeroporto nella capitale, che fornirà un hub per la crescita del paese",it,2
"Sono sempre stato un fan della serie animata, ed è la prima volta che riesco a vederla di persona.",it,2
"""Si vas a ser el primero en admitirlo, vas a tener que salir de aquí"", dijo.",es,0
Le sénateur américain Jeff Sessions est maintenant à la Maison Blanche pour la première fois depuis que le président a pris ses fonctions.,fr,2
"Un mes después de que la Corte Suprema de EE.UU. dictaminara que el matrimonio entre personas del mismo sexo es un derecho constitucional federal, el caso se está examinando en un",es,0
3.6.3 Tapo corrigé 2.6.2 Correction d'un bug où les joueurs n'obtiendraient pas de Réalisation pour avoir tué le patron.,fr,0
"
The Washington Capitals are looking to add a player to their roster as the team looks to add the ability to add players to the lineup in the",en,2
".

The new rule was put in place by the National Consumer Law Enforcement Network (NCLEN), which was created in 1999. It",en,2
"
By James Watson

(Reuters) - The United States will not withdraw from the Paris climate agreement unless Congress acts, the White House said",en,0
"Eine Reihe von Faktoren haben zu einigen geringfügigen Änderungen in Form von neuen Funktionen geführt, die es Benutzern ermöglichen, ein Tablet als vollwertiges",de,2
1 1 1 2 2 1 3 2 4 4 4 5 5 3 6 6 7 4,de,0
"Eine neue Studie der University of Michigan hat ergeben, dass Menschen, die einen erhöhten Cholesterinspiegel hatten, anfälliger für Herzerkrankungen sein können.",de,2
"MEMPHIS, Tenn. (AP) - Tennessee hat einen Top-Anwalt eingestellt, um zu helfen, das umstrittene Wähler-ID-Gesetz des Staates zu verteidigen",de,2
"'This is not a question of why they had to fight. This is about how they lost. They lost it.'

The former Tottenham",en,2
"Die Bundesregierung ist in Rekordform zu sagen, dass die USA in Verletzung des Völkerrechts ist, wenn sie behauptet, es nicht verletzt keine",de,0
"Brianna Wu, ehemalige Präsidentin der National Association for the Advancement of Colored People (NAACP), wurde beschuldigt,",de,0
Sac en plastique imprimé 3d (avec une échelle 1/8) Engagement 5 $ ou plus pour gagner ces 3d imprimés sur mesure,fr,2
J'ai fait quelques recherches sur la façon d'utiliser l'API Google Maps pour créer une carte interactive pour aider les gens à trouver leur chemin vers la ville.,fr,1
La compañía también dijo que compraría la tecnología de una empresa que no paga impuestos.,es,0
"BEN JANEIRO - Un enseignant américain né en Afrique du Sud a été arrêté à son domicile à Bodega, en Afrique du Sud, après avoir prétendument volé",fr,0
"Dans son livre, The Rise of the Class War, George Orwell a inventé le terme de « guerre de classe » pour décrire une guerre de classe qui a commencé dans le",fr,2
Curioso per l'attuale stato del mondo? Non sorprende che la Cina sia ora sede della più grande economia del mondo.,it,1
Das Ministerium für Umweltschutz des Staates legte zwei Umweltpläne für die vorgeschlagene E.p.A. vor. Im Jahr 2015 stellte die Agentur Pläne für die,de,1
"Dans son article, le Dr Richard Coyle, du New York Times, a écrit dans son livre, « The First Law of Therapeutics », qui",fr,2
"""Ich kann nicht glauben, dass die Zahlen so niedrig sind"" John McAfee John McAfee gilt als der Mann, der die",de,2
"""La risposta del governo è stata quella di chiamare la polizia per il presunto stupro di una studentessa che ha detto loro che era una studentessa e che la scuola",it,0
Es gibt momentan keine aktiven Threads für dieses Thema. Es gibt momentan keine aktiven Threads für dieses Thema.,de,1
Almeno uno dei 10 migliori segreti custoditi nel settore è che si può comprare tutto. E la parte migliore,it,2
È passato molto tempo da quando ho trovato la persona giusta per guidarmi attraverso questo processo. Questo blog è dedicato ad aiutare le persone ottenere,it,2
"Il Dipartimento di Stato di venerdì ha declassificato una serie di documenti relativi agli attacchi di Bengasi, tra cui un rapporto che sosteneva che gli aggressori utilizzavano server privati per la loro",it,0
"Ich benutze dieses Skript, um meine E-Mail-Adresse und Passwort zurück an den Benutzer zu bekommen. Zum Beispiel $ curl http://web",de,0
L'FBI alla fine di aprile ha rilasciato una dichiarazione sul possibile coinvolgimento del sospettato nell'omicidio di una donna in Carolina del Sud. L'FBI ha detto,it,0
"No soy un fan de la idea de hacer un juego específicamente para el iPhone y el iPad, pero estaba interesado en hacer un juego para jugar",es,0
"
The first two games of the NBA Finals are set to take place on Saturday, March 14, at 7 PM PT/10 PM ET.",en,2
"Non sto dicendo che il governo non può fare qualcosa, giusto? Insomma, è un governo che può fare qualcosa, se questo è",it,0
"Non so come descriverne l'aspetto, ma sono molto divertenti con cui giocare.",it,2
"Ha sido un gran viaje para mí para finalmente conseguir mis manos en mi primer Mac Pro. Siempre estoy interesado en aprender cosas,",es,2
"Viele Leute haben mich gefragt, wie Sie Ihre eigenen Haare in einem Schuss machen können? Nun, es gibt zwei Möglichkeiten, es zu tun:",de,2
"Wenn du ein Kind bist, hast du schon ziemlich Angst, aber jetzt, mit dem Aufkommen des Internets, kannst du etwas ganz anderes tun.",de,2
"
This article is about the character. For the other characters in the series, see Aridom

Aridom (ホト",en,1
The two men are accused of being part of an organized crime ring that has sent over $1 million in stolen goods to Mexico and other parts of,en,0
Un pequeño pueblo en el norte de Nueva Jersey fue robado por un grupo de hombres enmascarados el mes pasado después de que supuestamente robaron un banco en un pueblo a las afueras de New York.,es,0
"Si noterà che il numero di commenti non cresce così veloce nel tempo. Quando si aggiorna il tuo sito, ogni commento viene aggiornato due volte, con",it,1
"Ein Mann, dem vorgeworfen wird, eine Frau in ihrem Haus in San Diegos San Diego Central zu vergewaltigen, wurde wegen schwerer Entführung angeklagt.",de,1
Qu'est-ce qu'un GSMN (Global Positioning System)? GSMN est un système qui mesure la vitesse du transport aérien en utilisant,fr,1
"A pair of North Korean missiles have reportedly been spotted in a sea of smoke.

The South Korean military said on Friday that the missile,",en,0
"
The following is a list of the best in-game items for the game.

Items that you can buy from a merchant.
",en,2
"""Es ist eine Schande, dass so viele Menschen in der Dunkelheit mit der Wahrheit über die Angriffe auf unser Land und ihre Aktionen in diesem",de,0
"It was announced on Tuesday that Kiyoshi (the title of the character in the anime) would be joining the cast of the drama ""M",en,1
